nama_usaha,alamat_usaha,badan_usaha,penanggung_jawab,wilayah,no_telepon,no_fax,jenis_usaha,kapasitas
Warung Tekko,"Plaza Kalibata Lt. GF #02 & GF#06 Jl. Raya Kalibata No. 1, Pancoran",PT. Kalibata Selera Nusantara,Tjan Fong Tjin,Jakarta Selatan,,,Restoran,15/50/B
Warung Tekko,"SCBD, Jl. Jend. Sudirman Kav. 52-53 Lot. 8",PT. Tekko Seumur Hidup BEJ,Yansen,Jakarta Selatan,021 5152767,,Restoran,10/50/B
Warunkomando,Jl. Dr. Sahardjo Raya No. 1,PT. Kopitiam Komando Indonesia,Susanty,Jakarta Selatan,,,Restoran,15/50/B
Wayo-Men,Jl. HR. Rasuna Said Kav. 62,PT. Hikari Boga Sarana,Idjung Mulyadi,Jakarta Selatan,,,Restoran,12/48/B
Well Done Steak House,Jl. Jend. Sudirman Kav. 50 Lt. 10,PT. Sajian Pangan Nusantara,"Iwan Gustriwanto, SE",Jakarta Selatan,021 7985951,021 7985949,Restoran,30/80/A
Wendy's,"Perkantoran Hijau Arcadia, Jl. TB. Simatupang Kav. 88",PT. Trans Burger,"Warnedy, AK., MSc",Jakarta Selatan,021 7892218,021 78845544,Restoran,42/84/A
Wendy's,"Pasar Festival, Jl. HR. Rasuna Said Kav. C-22",PT. Trans Burger,"Warnedy,AK, MSc",Jakarta Selatan,021 5276666,021 5263181,Restoran,54/108/A
Wendy's,"Perkantoran Hijau Arcadia, Jl. TB. Simatupang Kav. 88",PT. Trans Burger,"Warnedy,AK, MSc",Jakarta Selatan,021 7892218,021 78845544,Restoran,42/84/A
Wendy's,"Plaza 89 Ground Floor, Jl. HR. Rasuna Said Kav X-7/6",PT. Trans Burger,"Warnedy,AK, MSc",Jakarta Selatan,021 5260088,021 2520470,Restoran,58/114/A
Wendy's,"Mall Pacific Place Lt. 5, Jl. Jend.Sudirman Kav. 52-53",PT. Trans Burger,"Warnedy,AK, MSc",Jakarta Selatan,021 5151222,021 51400626,Restoran,52/88/A
Wendy's,Jl. Jend. Sudirman Kav. 27,PT. Trans Burger,"Warnedy,AK, MSc",Jakarta Selatan,021 5206666,021 5237062,Restoran,40/80/A
Wendy's,"Mal Pondok Indah Lt. 2 No. 204-239, Jl. Metro Pondok Indah",PT. Trans Burger,"Warnedy,AK, MSc",Jakarta Selatan,021 7506971,021 7506977,Restoran,54/112/A
Wendy's Hamburger,Jl. Metro Pondok Indah No. 204,PT. Wendy's Citrarasa,Belinda Tek Lu Bi Lien,Jakarta Selatan,021 7506971,,Restoran,88/200/A
Wendy's Hamburger,Jl. HR. Rasuna Said Kav X-7 No. 6,PT. Wendy Citrarasa,Belinda Tek Lu Bi Liien,Jakarta Selatan,,,Restoran,35/116/A
Wendy's Hamburger,Jl. Jend. Sudirman,PT. Wendy Citrarasa,Belinda Tek Lu Bi Lien,Jakarta Selatan,021 5237061,,Restoran,50/230/A
White Box,"Mal Kota Kasablanka, Jl. Casablanca Kav. 88",Julia Tjandra,Julia Tjandra,Jakarta Selatan,021 83709888,021 83706888,Restoran,15/60/A
White Elephant,"Cilandak Town Square, Jl. TB. Simatupang Kav. 1",PT. Petgo Bastian,Louis Larry,Jakarta Selatan,021 75920367,,Restoran,10/50/B
White Elephant,"Lippo Mall Kemang Village, Jl. Kemang VI",Louis Larry,Louis Larry,Jakarta Selatan,021 29056836,,Restoran,14/60/A
White Elephant,"Kota Kasablanka, Jl. Casablanca Raya Kav. 88",Louis Harry,Louis Larry,Jakarta Selatan,021 29488686,021 29488686,Restoran,10/50/B
"White Hunter Ribs, Grill, & Bar","Gandaria City, Jl. Sultan Iskandar Muda No. 30",PT. Global Sukses Sejahtera,Danny Leo,Jakarta Selatan,021 7247878,021 7262836,Restoran,20/80/A
Wijaya Soju Café,"Wijaya Graha Puri Blok F No. 37, 38, 39, Jl. Wijaya II",CV. Harapan Baru,Widodo,Jakarta Selatan,,,Restoran,10/50/B
William Kafe Artistik,Jl. Panglima Polim Raya No. 63,PT. Bina Selera Mandiri,William Wirjaatmaja W.,Jakarta Selatan,021 7244911,021 7202702,Restoran,26/200/A
Wilshire,"Gd. Semanggi Expo SCBD Lot. 8, Jl. Jend. Sudirman Kav. 52-53, Senayan, Kebayoran Baru",PT. Edesia Global,Hanna Tjhin,Jakarta Selatan,,,Restoran,50/100/A
Wing Stop,"Mal Kota Kasablanka, Jl. Casablanca Kav. 9-10",PT. Wiryamanta Sadina,Irzan Hanafiah Pulungan,Jakarta Selatan,,,Restoran,15/50/B
Wing Stop,"Gd. Setiabudi One, Jl. HR. Rasuna Said Kav. 62",PT. Wiryamanta Sadina,Irzan Hanafiah Pulungan,Jakarta Selatan,,,Restoran,15/50/B
Wmiitem,"Mal Kota Kasablanka Lt.2 Unit 246 A, Jl. Casablanca Raya Kav. 88",PT. Bhogi Kalyana Wara,Lusianawati Rahardjo,Jakarta Selatan,021 7244911,021 7202702,Restoran,51/103/A
Wok & Rol,Jl. Jend. Gatot Subroto Kav. 9-11,PT. Inti Karya Boga,Andre Widarto Soeprapto,Jakarta Selatan,,,Restoran,15/40/B
Wolter Bistro,Jl. Woltermonginsidi No. 59,PT. Mitramedia Lestari Nusantara,Nuruladhya Windhiasari,Jakarta Selatan,021 8350053,021 8350053,Restoran,10/50/B
Woo Ri Jung,Jl. Wolter Monginsidi No. 49 RT001/RW001,CV. Berkat Anugerah Sentosa,Alexander Eartha Kingo,Jakarta Selatan,,,Restoran,14/50/B
X.O Suki & Dimsum,"Kuningan City Mall, Jl. Prof. Dr. Satrio Kav. 18",PT. Golden Utama Sakti,Silvy Chitra Harthanadi,Jakarta Selatan,021 30480570,021 30480571,Restoran,29/128/A
Xiung Mao Chinese,Jl. Jend. Sudirman Kav. 50 Lt.3,PT. Bettafood Cipta Rasa,Anthony Titus Subari,Jakarta Selatan,021 5363454,021 5325622,Restoran,25/50/B
Y & Y,Jl. Jend. Sudirman Kav. 52-53,PT. Multi Pangan Lestari,Yerline Hanani,Jakarta Selatan,,,Restoran,55/165/A
Yakinikuya,"Darmawangsa Square, Jl. Darmawangsa VI & IX",PT. Brosco Citarasa Mandiri,Bryan Haryanto Thamrin,Jakarta Selatan,,,Restoran,15/60/A
Yakoya,Jl. Sultan Iskandar Muda No. 1B,PT. Top Bread,Hami Wardimawati,Jakarta Selatan,021 7239852,021 7239853,Restoran,20/100/A
Yokunatta,"Permata Senayan, Jl. Tentara Pelajar Blok E16&1",PT. Yokunatta,Renaldy Scharif,Jakarta Selatan,,,Restoran,10/40/B
Yo'panino,"Mal Kota Kasablanka, Jl. Casablanca Raya Kav. 88",PT. Swaadh Indonesia,Jitin Singh Kapoor,Jakarta Selatan,,,Restoran,10/34/B
Yoshinoya,Jl. HR. Rasuna Said Kav. C 22 GMSB U UG-A6,PT. Multirasa Nusantara,Widya Katuari,Jakarta Selatan,021 7235317,021 7235317,Restoran,10/60/A
Yoshinoya,Jl. Metro Pondok Indah Blok III B,PT. Multirasa Nusantara,Widya Katuari,Jakarta Selatan,,,Restoran,15/50/B
Yoshinoya,Jl. Wolter Monginsidi No. 62 RT001/RW004,PT. Multirasa Nusantara,Widya Katuari,Jakarta Selatan,,,Restoran,20/80/A
Yoshinoya,Jl. Bulungan No. 160,PT. Multirasa Nusantara,Widya Katuari,Jakarta Selatan,,,Restoran,15/50/B
Yoshinoya,Jl. Jend. Sudirman Kav. 50,PT. MultirasaNusantara,Widya Katuari,Jakarta Selatan,,,Restoran,15/50/B
Yoshinoya,"Lotte Shopping Avenue Ciputra World I, Jl. Prof. Dr. Satrio Kav. 3-5, Karet Kuningan, Setiabudi",PT. Multi Rasa Nusantara,Hardjanto Salim,Jakarta Selatan,021 57904411,021 57904412,Restoran,10/60/B
Yoshinoya,ITC Kuningan Jl. Prof. Dr. Satrio Kav. 25,PT. Multirasa Nusantara,Widya Katuari,Jakarta Selatan,021 57904411,,Restoran,15/30/B
Yoshinoya,ITC Kuningan Jl. Prof. Dr. Satrio Kav. 25,PT. Multirasa Nusantara,Widya Katuari,Jakarta Selatan,021 57904411,021 57904411,Restoran,15/30/B
You Only Live Once,Jl. Kemang Raya No. 69 E,CV. Bread and Butter,Egan Chandra,Jakarta Selatan,,,Restoran,20/80/A
Yuki,"Blok M, Jl. Melawai VI No. 8 ",PT. Sum Mustika Prima,Engki Wibowo,Jakarta Selatan,021 7247727,021 7227766,Restoran,12/40/B
Yuki 1,"Blok M, Jl. Melawai VI No. 1",PT. Sum Mustika Prima,Engki Wibowo,Jakarta Selatan,021 7257837,,Restoran,15/60/A
Yumeya,Jl. Melawai VIII No. 2,PT. Blue Safir,Nazilatul Anis,Jakarta Selatan,021 72798402,021 72798404,Restoran,12/48/B
Zanas Bar & Grill,Jl. Ampera Raya No. 05 RT001/RW008,PT. Zanas Agung,Arief Kusraharjo,Jakarta Selatan,,,Restoran,12/48/B
Zenbu,"Mal Kota Kasablanca, Jl. Casablanca Kav. 9-10",CV. Zenbu Kota Kasablanka,Martony,Jakarta Selatan,,,Restoran,30/86/A
Zhuma,"Gd. Pacific Place Lt. 5 Unit 5-12 SCBD, Jl. Jend. Sudirman Kav. 52-53",PT. Zhuma Mitra Jaya,Julianti Widjaja,Jakarta Selatan,021 57936171,021 57936173,Restoran,10/40/B
Zodiacus,Jl. Mega Kuningan Barat Kav.E4.3,PT. Safee & Son's,Parekat Vynat Shivanand,Jakarta Selatan,,,Restoran,15/50/B
Zodiacus,Jl. Mega Kuningan Barat Kav.E4.3,PT. Safee & Son's,Parekat Vynat Shivanand,Jakarta Selatan,,,Restoran,15/50/B
Zoe Coffee Shop,"Bellagio Boutique Mal, Jl. Mega Kuningan Barat ",PT. Alvian Duta Persada,Agista Aryani Bombay,Jakarta Selatan,021 30066192,021 5/20/B,Restoran,
A & W Family,"Cibubur Junction, Jl. Jambore Raya No. 1",PT. Prima Usaha Era Mandiri,Zaina Siman,Jakarta Timur,021 6623456,,Restoran,10/40/B
A & W Family,"Gd. Green Terrace, Jl. Pintu I Taman Mini Indonesia",PT. Prima Usaha Era Mandiri,ZAINA SIMAN,Jakarta Timur,021 28985000,021 87783536,Restoran,10/40/B
A & W Family,"Taman Mini Indonesia Indah, Jl. Raya Pondok Gede",PT. Prima Usaha Era Mandiri,Zaina Siman,Jakarta Timur,,,Restoran,10/40/B
A & W Family,"Jl. Raya Bogor  Km. 19, Kramat Jati Indah",PT. Prima Usaha Era Mandiri,Zaina Siman,Jakarta Timur,,,Restoran,10/40/B
A & W Family,Jl. Raya Bekasi Km. 21,PT. Prima Usaha Mandiri,Zaina Siman,Jakarta Timur,021 8623456,,Restoran,10/40/B
A & W Family,"Pusat Grosir Cililitan, Jl. Mayjend Sutoyo No. 76",PT. Prima Usaha Era Mandiri,Zaina Siman,Jakarta Timur,021 6623456,021 6623456,Restoran,10/30/B
A & W Family,Jl. Paus No. 85A,PT. Prima Usaha Era Mandiri,Zaina Siman,Jakarta Timur,021 4758787,021 4898320,Restoran,20/80/A
Abunawas,Jl. Matraman No. 15,CV. Anugrah Putra Marco,Hamdan,Jakarta Timur,021 8583914,021 819926,Restoran,25/100/A
Aila,Jl. Dewi Sartika No. 34 RT005/RW012,Mochamad Assegaf,Mochamad Assegaf,Jakarta Timur,,,Restoran,44/110/A
Al Derah,Jl. Matraman Raya No. 64 RT011/RW002,PT. Indo Saqur,Adil Farouk Nahdi,Jakarta Timur,021 8583084,021 8583084,Restoran,18/70/A
American Hamburger,Jl. Mayjen Sutoyo No. 76,PT. American Hamburger,Judit Mukti Wibawa,Jakarta Timur,,,Restoran,23/43/B
Anggrek,Jl. Raya Bekasi Timur No. 9,,Hidayat Kosasih,Jakarta Timur,,,Restoran,13/38/B
Ayam Goreng Ny. Suharti,Jl. Pemuda No. 3 A,,Sjahlan Prapto Hardjono,Jakarta Timur,021 4757645,021 4891105,Restoran,20/80/A
Ayam Goreng Suharti,Jl. Dewi Sartika No. 237 RT004/RW004,,Ny. Suharti,Jakarta Timur,,,Restoran,30/180/A
Bakmi Gm,"Cibubur Junction, Jl. Jambore No. 1",PT. Griya Miesejati,Piely Dian Lie,Jakarta Timur,,,Restoran,14/50/B
Bakmi Golek,Jl. Dewi Sartika No. 310A,,Arwan Atmadja,Jakarta Timur,,,Restoran,29/116/A
Bakmi Golek,Jl. Otista Raya No. 458,,Arwan Atmadja,Jakarta Timur,021 8193047,,Restoran,8/32/B
Bakmi Golek,Jl. Raya Kalimalang No. 14,,Arwan Atmadja,Jakarta Timur,,,Restoran,44/176/A
Bakmi Jatiwaringin,Jl. Jatiwaringin No. 7 RT011/RW005,CV. Citra Boga Makmur,Lim Stephen,Jakarta Timur,,,Restoran,20/80/A
Bakmi Naga,"Rest Area Tol Jagorawi Km 10+600, Jl. Boton",PT. Gracia Multifood Lestari,Ali Susanto,Jakarta Timur,021 29268305,,Restoran,10/40/B
Bakso Malang Karapitan,"Grand Cakung, Jl. Sultan Hamengkubuwono IX Km 25, Cakung",PT. Champ Resto Indonesia,Ali Gunawan Budiman,Jakarta Timur,,,Restoran,20/80/A
Bale Bengong,Jl. Angkasa Halim Perdanakusuma RT005/RW009,CV.Oscar Group,Sumartiningsih,Jakarta Timur,021 80888182,021 80888182,Restoran,10/40/B
Brooaster Chicken,Jl. Boton Rest Area Tol Jagorawi KM10,PT. Usaha Sari Boga,Edi Amin,Jakarta Timur,,,Restoran,10/40/B
Bumbu Desa,Jl. Boton Rest Area Tol Jagorawi KM 10+600,PT. Masterboga Suksesmakmur,Brahmanta,Jakarta Timur,021 29068292,021 29068289,Restoran,14/50/B
Bumbu Desa,"Tamini Square LS No. 1-7 LS VII, Jl.Taman Mini Indonesia",PT. Master Boga Sukses Makmur,Brahmanta,Jakarta Timur,021 88860759,021 88860754,Restoran,31/92/A
Bumbu Desa,Jl. Taman Mini Raya,PT. master Boga Sukses Makmur,Brahmanta,Jakarta Timur,021 88860759,021 88860754,Restoran,31/92/A
Burger & Grill,Jl. Raya Kalimalang Blok A2 No. 8-9,,Drs. Muchtar,Jakarta Timur,021 86902794,,Restoran,45/160/A
Burger King,Jl. Kol Sugiono RT003/RW002,PT. Sari Burger Indonesia,Ir. Jusroni,Jakarta Timur,021 5745808,021 5746189,Restoran,70/150/A
Burger King,"Jl. Boton Rest Area Tol Jagorawi, Cibubur Square",PT. Sari Burger Indonesia,Ir. Jusroni,Jakarta Timur,,,Restoran,55/110/A
Café Lagundi,Jl. Raya Sultan Hamengkubuwono Blok B/2,,Rospita Aritonang,Jakarta Timur,,,Restoran,20/60/B
Cahaya Timur,Jl. Pegambiran Raya No. 24,-,Anton Wijaya,Jakarta Timur,021 4751919,021 4751919,Restoran,25/100/A
Captain Jack's Cuisine,Jl. Raya Taman Mini Indonesia Indah,PT. Arum Investment Indonesia,Kim Kyunggo,Jakarta Timur,021 87783530,021 87783580,Restoran,25/100/A
Celsius Cafe & Grill,"Jl. Balap Sepeda No. 6 Blok H, Persil",PT. Celsius Cafe & Grill,Kenny Salmon,Jakarta Timur,021 4706666,,Restoran,20/80/A
CFC,"Plaza Buaran, Jl. Raden Inten No. 1",PT. Pioneerindo Gourmet Intl,Kusuwandi Tamin,Jakarta Timur,,,Restoran,12/48/B
CFC,"Gd. Hero, Jl. Raya Cijantung No. 11 ",PT. Pioneerindo Gourmet Int'l,Dwijanto Gondokusumo,Jakarta Timur,,,Restoran,12/49/B
CFC,"Jl. Raya Perumnas Blok A, Klender",PT. Pioneerindo Gourmet Int'l,Dwijanto Gondokusumo,Jakarta Timur,,,Restoran,25/100/A
CFC,Jl. Mayjend  Sutoyo No. 76,PT. Pioneerindo Gourmet Int'l,Kusuwandi Tamin,Jakarta Timur,,,Restoran,12/48/B
CFC,"Gd. Hero, Jl. Raya Cijantung No. 11 ",PT. Pioneerindo Gourmet Int'l,Dwijanto Gondokusumo,Jakarta Timur,,,Restoran,12/49/B
CFC,Jl. Raya Condet No. 333 RT005/RW003,PT. Pioneerindo Gourmet International,Kusuwandi Tamin,Jakarta Timur,,,Restoran,15/50/B
CFC,Jl. Raya Bekasi Timur,PT. Pioneerindo Gourmet Int'l,Dwijanto Gondokusumo,Jakarta Timur,,,Restoran,18/52/A
CFC,"RS. UKI, Jl. Mayjend  Sutoyo No. 76",PT. Pioneerindo Gourmet Intl,Kusuwandi Tamin,Jakarta Timur,,,Restoran,12/48/B
CFC,"Pulo Gadung, Jl. Raya Bekasi Km. 21",PT. Pioneerindo Gourmet International,Murniaty Kartono,Jakarta Timur,,,Restoran,12/48/B
Charlie Vht,"Rawamangun Square, Jl. Pegambiran No. 55",CV. Rejeki Bersaudara,Andreas Lihat Budoyo,Jakarta Timur,,,Restoran,5/10/C
Chicken Station,Jl. Jambore No. 1,PT. Ceria Inti Sukses,Hanny Salimun,Jakarta Timur,021 87756417,,Restoran,20/80/A
C'one Hotel Pulomas,"Jl. Jend. Achmad Yani RT001/RW009, Pulo Mas",PT. Jakarta Tourisindo,"Drs. Idris Sasmita, MM",Jakarta Timur,,,Restoran,6/30/B
D' Artist Family Ktv,"Grand Cakung Group Floor I, Jl. Sultan Hamengkubuwono IX Km 25, Cakung",CV. Mitra Abadi Sejahtera,William Soetedjo,Jakarta Timur,,,Restoran,10/50/B
D' Cost,"Pusat Grosir Cililitan (PGC), Jl. Mayjen Sutoyo No. 76, Cililitan, Kramat Jati",PT. Pendekar Bodoh,David Vincent Marsudi,Jakarta Timur,021 7342003,021 7342003,Restoran,14/50/B
D' Cost,"Rawamangun Square, Jl. Pegambiran No. 55",PT. Pendekar Bodoh,David Vincent Marsudi,Jakarta Timur,021 7342003,021 7342003,Restoran,14/60/B
D' Frenz,Jl. Pinang Raya No. 1 B RT001/RW009,PT. Asa Melody Pratama,"Ridwansyah Sirait, SH",Jakarta Timur,,,Restoran,3/20/B
Dapur Solo,Jl. Matraman Raya No. 18,PT. Dapur Solo Sukses Sejati,Heru Kustatnto Kumarga,Jakarta Timur,021 85901372,021 85902037,Restoran,20/80/A
Dinasty Cafe,Jl. Raya Bekasi KM.25,,Asiah Wiwik,Jakarta Timur,,,Restoran,10/40/B
Do' An,Jl. Jambore No. 1,PT. Anugrah Boga Sejahtera,Setiawan Adi Kuncoro,Jakarta Timur,,,Restoran,10/40/B
Domino's Pizza,"Orchard Junction, Jl. Perintis Kemerdekaan No. 4",PT. Dom Pizza Indonesia,Jusroni,Jakarta Timur,021 29069293,021 29069296,Restoran,4/16/C
Domino's Pizza,Jl. Condet Raya No. 58,PT. Dom Pizza Indonesia,Ir. Jusroni,Jakarta Timur,021 5721368,021 5721369,Restoran,11/37/B
Domino's Pizza,"Jl. Raden Inten, Jl. RS. Jend. Pol. Sukamto",PT. Dom Pizza Indonesia,Ir. Jusroni,Jakarta Timur,,,Restoran,8/28/B
Gado Gado Boplo,Jl. Jatinegara Timur No. 60 RT011/RW003,Juliana Hartono,Juliana Hartono,Jakarta Timur,,,Restoran,20/60/A
Gin Thai,Jl. Raya Kalimalang Blok F/18,PT. Putra Bumi Satria,Aginta Adrie Julian,Jakarta Timur,021 7195941,021 71793021,Restoran,25/100/A
Gokana Teppan,"Gd. JX Jatinegara Xtainment, Jl. Jatinegara Timur",PT. Champ Resto Indonesia,Ali Gunawan Budiman,Jakarta Timur,021 7996703,021 7996703,Restoran,30/70/A
Grand Charly Vhi Karaoke,Jl. Pintu I Taman Mini Indonesia Indah Lt.2,PT. Cahaya Anugrah Hati,Nurohmah,Jakarta Timur,,,Restoran,10/30/B
Grand Hikmah,"Gd. Wahana Cipta Sejahtera, Jl. Letjend. Sutoyo",PT. Wahana Dwi Rezeki,"Arie Sardjono Idris, SE",Jakarta Timur,,,Restoran,15/50/B
Gurih,Jl. Pramuka Raya No. 150,,Iva Dewi Permata,Jakarta Timur,021 8590014,021 8574084,Restoran,47/256/A
Hanamasa,"Tamini Square, Jl. Taman Mini Raya",PT. Adi Boga Cipta,"H. Rachmatullah,SE",Jakarta Timur,,,Restoran,12/50/B
Handayani Prima,Jl. Matraman Raya No. 45,PT. Handayani Prima,Bistok Hutagalung,Jakarta Timur,021 8582321,021 8583912,Restoran,60/360/A
Hokben,"Plaza Buaran, Jl. Raden Inten No. 1",PT. Eka Boga Inti,Hendra Arifin,Jakarta Timur,,,Restoran,10/50/B
Hokben,Jl. Balai Pustaka Timur Blok A2 No. 29,PT. Eka Bogainti,Hendra Arifin,Jakarta Timur,,,Restoran,20/80/A
Hokben,"Tamini Square, Jl. Raya Taman Mini",PT. Eka Bogainti,Hendra Arifin,Jakarta Timur,,,Restoran,46/106/A
Hokben,Jl. Raya Bekasi Km. 21,PT. Eka Bogainti,Hendra Arifin,Jakarta Timur,,,Restoran,18/61/A
Hokben,"Pusat Grosir Cililitan (PGC), Jl. Mayjend Sutoyo No. 76, Cililitan, Kramat Jati",PT. Eka Bogainti,Hendra Arifin,Jakarta Timur,021 30016789,021 30019010,Restoran,33/70/A
Hokben,"Jl. Raya Bekasi KM 25, Jl. Sultan Hamengkubuwono",PT.Eka Boga Inti,Hendra Arifin,Jakarta Timur,021 42877717,021 42877717,Restoran,25/50/B
Hokben,Jl. Jatinegara Timur No. 37B RT006/RW004,PT. Eka Boga Inti,Hendra Arifin,Jakarta Timur,021 7209240,021 7209240,Restoran,10/20/B
Hokben,"Cibubur Town Square, Jl. Jambore No. 1",PT. Eka Bogainti,Hendra Arifin,Jakarta Timur,021 25536448,021 25536448,Restoran,20/80/A
Hokben,"Plaza Arion, Jl. Pemuda Kav. 4-5",PT. Eka Bogainti,Hendra Arifin,Jakarta Timur,021 4701485,021 4701485,Restoran,36/72/A
Hokben,Jl. Tarum Barat Kalimalang Blok E No. 15 E-F,PT. Eka Boga Inti,Hendra Arifin,Jakarta Timur,021 8629760,021 86601236,Restoran,64/128/A
Hokben,"Graha Cijantung, Jl. Pasar Rebo Lt. 3",PT. Eka Bogainti,Hendra Arifin,Jakarta Timur,,,Restoran,41/152/A
Ichiban Sushi,Jl. Jambore No. 1,PT. Brostindo Prima Indonesia,Teddy Harsono,Jakarta Timur,021 87756484,,Restoran,12/40/B
Ichiban Sushi,Jl. Jambore No. 1,PT. Brostindo Prima Indonesia,Teddy Harsono,Jakarta Timur,021 87756484,,Restoran,12/40/B
Imperial Kitchen & Dimsum,"Cibubur Junction, Jl. Jambore No. 1 GF-AE I# T 0",PT. Adicipta Boga Intiprima,Abigail Djojonegoro,Jakarta Timur,021 87756629,021 87756630,Restoran,20/60/A
Imperial Kitchen & Dimsum,Jl. Jambore No. 1 GF-AE I# T 05 & 06,PT. Adicipta Boga Intiprima,Abigail Djojonegoro,Jakarta Timur,021 87756629,021 87756630,Restoran,20/60/A
Inul Vizta,"Kramat Jati Indah Plaza Lt. 3, Jl. Raya Bogor Km. 19",PT. Berkat Mega Swara,Wisnu Bastari,Jakarta Timur,021 8005507,021 8005508,Restoran,12/40/B
Inul Vizta,"Mall Cijantung Lt. 3, Jl. Pendidikan I",PT. Vizta Cakra Utama,Jemmy Robert,Jakarta Timur,,,Restoran,10/40/B
Inul Vizta,Jl. Inspeksi Kalimalang RT002/RW016,CV. Anugerah Jaya Abadi,"Helmayati Nurdiana, SE",Jakarta Timur,,,Restoran,5/20/B
Inul Vizta,"Cibubur Junction, Jl. Jambore No. 1",CV. Vizta Cibubur,Warni,Jakarta Timur,021 87756552,021 87756552,Restoran,10/40/B
Inul Vizta Family Ktv,"Plaza Buaran, Jl. Raden Inten I",CV. Cahaya Anugerah Sejati,Hj. Kiswati,Jakarta Timur,,,Restoran,8/26/B
Inul Vizta Family Ktv,"Plaza Buaran, Jl. Raden Inten I",CV. Cahaya Anugerah Sejati,Hj. Kiswati,Jakarta Timur,,,Restoran,8/26/B
J.M Café,"Rukan Inkopau Blok A-50 & 51, Jl. Sultan Hamengkubuwono IX Km. 25",Jeffry.P.Sibarani,Jeffry.P.Sibarani,Jakarta Timur,,,Restoran,10/50/B
Joni Steak,Jl. Kalimalang Raya Blok A.2 Kav. 3C-3,Syamsurizal,Syamsurizal,Jakarta Timur,,,Restoran,30/80/A
Karimata,"Taman Anggrek Indonesia Permai (TAIP), Jl. Raya TMII, Pinang Ranti, Makasar",-,Ir. Agung Eko Widodo,Jakarta Timur,,,Restoran,30/100/A
Kembang Lawang,"Mall Cipinang Indah, Jl. Raya Kalimalang Kav. 88",PT. Kembang Indosari,Liauw Vivi Susanti,Jakarta Timur,021 29486931,,Restoran,10/50/B
Kembang Lawang,"Tamini Square, Jl. Raya Pondok Gede, Jl. Taman Mini Raya Garuda, Pinang Ranti",CV. Modern Lifestyle,IE Andre Irawan,Jakarta Timur,021 87787816,021 87787816,Restoran,15/50/B
Kenny Rogers Roasters,Jl. Jambore No. 1,PT. Boga Lestari Sentosa,Budhi Purnama Utomo,Jakarta Timur,,,Restoran,20/60/A
Kentucky Fried Chicken,Jl. Raden Inten II No. 1,PT. Fast Food Indonesia,Rudy Tanudjaya. S,Jakarta Timur,021 8301133,021 8313368,Restoran,25/50/B
Kentucky Fried Chicken,Jl. Pemuda Arion Plaza,PT. Fastfood Indonesia,Rudy Tanudjaya Saputra,Jakarta Timur,,,Restoran,20/90/A
Kentucky Fried Chicken,Jl. Jatinegara Timur No. 84 ABC,PT. Fastfood Indonesia,Rudy Tanudjaya Saputra,Jakarta Timur,,,Restoran,14/56/A
Kentucky Fried Chicken,"JX Jatinegara X-taiment, Jl. Jatinegara Timur No. 60-62, Jatinegara",PT. Fastfood Indonesia,Rudy Tanudjaya S,Jakarta Timur,,,Restoran,15/50/B
Kentucky Fried Chicken,Jl. Tarum Barat/Kalimalang RT009/RW007,PT. Fastfood Indonesia,Rudy Tanudjaya S,Jakarta Timur,021 7182745,021 7182745,Restoran,14/50/B
Kentucky Fried Chicken,Hero Pondok Bambu Jl. Pahlawan Revolusi RT 3,PT. Fastfood Indonesia,Rudy Tanudjaya Saputra,Jakarta Timur,021 8607779,021 8607779,Restoran,32/130/A
Kentucky Fried Chicken,Jl. Jatinegara Timur No. 84 ABC,PT. Fastfood Indonesia,Rudy Tanudjaya Saputra,Jakarta Timur,021 8573529,021 8573529,Restoran,14/56/A
Kentucky Fried Chicken,"Plaza Buaran, Jl. Raden Inten RT001/RW004",PT. Fast Food Indonesia,Rudy Tanudjaya.S,Jakarta Timur,,,Restoran,10/50/B
Kentucky Fried Chicken,"Mal Citra, Jl. I Gusti Ngurah Rai RT009/RW001",PT. Fastfood Indonesia,Rudy Tanudjaya Saputra,Jakarta Timur,021 86605965,021 86605965,Restoran,50/170/A
Kentucky Fried Chicken,Jl. Tarum Barat Blok N No. 4,PT. Fastfood Indonesia,Rudy Tanudjaya Saputra,Jakarta Timur,,,Restoran,48/164/A
Kentucky Fried Chicken,Jl. Raya Bekasi Km. 24,PT. Fastfood Indonesia,Rudy Tanudjaya S,Jakarta Timur,,,Restoran,10/40/B
Kentucky Fried Chicken,Jl. Raya Bogor RT005/RW001,PT. Fastfood Indonesia Tbk.,Rudy Tanudjaya Saputra,Jakarta Timur,021 87711524,021 87711524,Restoran,80/170/A
Kentucky Fried Chicken,"Pusat Grosir Cililitan, Jl. Mayjend Sutoyo No. 76",PT. Fastfood Indonesia,Rudy Tanudjaya S,Jakarta Timur,021 8301133,021 8301133,Restoran,15/50/B
Kentucky Fried Chicken,"Gd. Tamini Square, Jl. Raya Pondok Gede, Jl. Taman Mini Raya",PT. Fastfood Indonesia,Rudi Tanudjaya Saputra,Jakarta Timur,021 8301133,021 8301133,Restoran,80/100/A
Kentucky Fried Chicken,"Plaza Arion, Jl. Pemuda No. 3",PT. Fastfood Indonesia,Rudy Tanudjaya Saputra,Jakarta Timur,021 4713244,021 4713244,Restoran,48/164/A
Kentucky Fried Chicken,Jl. Pendidikan I Cijantung II,PT. Fastfood Indonesia,Rudy Tanudjaya Saputra,Jakarta Timur,021 8403889,,Restoran,25/100/A
Kentucky Fried Chicken,"PP Plaza, Jl. Raya Gedong Panjang",PT. Fastfood Indonesia,Rudy Tanudjaya Saputra,Jakarta Timur,021 8403889,021 8403889,Restoran,55/220/A
Kentucky Fried Chicken,Jl. Pegambiran No. 55,PT.Fast Food Indonesia,Rudy Tanudjaya.S,Jakarta Timur,,,Restoran,20/80/B
Kentucky Fried Chicken,"Graha Cijantung, Jl. Pendidikan I Cijantung II",PT. Fastfood Indonesia,Rudy Tanudjaya Saputra,Jakarta Timur,021 8403889,021 8403889,Restoran,25/100/A
Kremesan,"Bandara Halim Perdanakusuma Lobby Terminal, Jl. Protokol Halim Perdana Kusuma",PT. Kencana Aditya Gemilang,HJ. HENNY HENDRAWATI,Jakarta Timur,021 8093744,021 8093744,Restoran,14/45/B
Lawton Coffee,Jl. Boton Rest Area Tol Jagorawi,PT. Karya Resources Persada,Lau Peter,Jakarta Timur,021 29068283,,Restoran,8/20/B
Lesehan Gurame,Jl. Pemuda No. 77,,FX. Imran Tanoto,Jakarta Timur,,,Restoran,35/140/A
Little Penang,Jl. Jambore No.1,PT. Panca Mitrasari Lestari,Bernt Hanlee Ramli,Jakarta Timur,,,Restoran,15/60/B
Little Penang,"Cibubur Junction, Jl. Jambore No. 1",PT. Panca Mitrasari Lestari,Sumarno Ngadiman,Jakarta Timur,021 5868880,021 5868880,Restoran,10/40/B
Lotte Mart,Jl. Lingkar Luar Selatan Kav. 6,PT. Lotte Shopping Indonesia,Alfian,Jakarta Timur,,,Restoran,10/40/B
Makanan Dan Minuman Food Court Pc,"Pulo Gadung Trade Center, Jl. Raya Bekasi Km. 21, Pulogadung, Kawasan Industri PT. Jiep",PT. Nagaraja Lestari,Hadi Setiadarma Ho,Jakarta Timur,021 4600387,021 4605117,Restoran,200/800
Mc Donalds,Jl. Raya Cipayung RT006/RW002,PT. Rekso Nasional Food,Sukowati Sosrodjojo,Jakarta Timur,,,Restoran,20/80/A
Mc Donald's,"Arion Mall, Jl. Pemuda Kav. 3",PT. Rekso Nasional Food,Sukowati Sosrodjojo,Jakarta Timur,,,Restoran,45/150/A
Mc Donald's,"Tamini Square, Jl. Raya Taman Mini Garuda, Pinang Ranti",PT. Rekso Nasional Food,Sukowati Sosrodjojo,Jakarta Timur,021 87786060,021 87786060,Restoran,20/80/A
Mc Donald's,"PGC, Jl. Mayjend  Sutoyo No. 76",PT. Rekso Nasional Food,Sukowati Sosrodjojo,Jakarta Timur,021 30019076,021 30019077,Restoran,70/144/A
Mc Donald's,"Graha Cijantung, Jl. Pendidikan I",PT. Rekso Nasional Food,Sukowati Sosrodjojo,Jakarta Timur,021 87793325,021 87793315,Restoran,70/167/A
Mc Donald's,"Jl. Kol.Sugiono, Raden Inten",PT. Rekso Nasional Food,Sukowati Sosrodjojo,Jakarta Timur,021 8602693,021 8602592,Restoran,70/150/A
Mc Donald's,Jl. Inspeksi Saluran Kalimalang Shophouse,PT. Rekso Nasional Food,Sukowati Sosrodjojo,Jakarta Timur,021 86604057,021 86604058,Restoran,32/76/A
Mekar Lesehan,Jl. Raya Bogor No. 52A,,H Suyatno,Jakarta Timur,021 80885629,,Restoran,49/150/A
Mister Baso,Jl. Jambore No.1,,Martinus Lilik Setiabudi,Jakarta Timur,,,Restoran,55/82/A
Mister Baso,Jl. Jambore No.1,,Martinus Lilik Setiabudi,Jakarta Timur,,,Restoran,55/82/A
Mister Baso,Jl. Raya Bogor Kramat Jati,PT. Mister Baso Indonesia,Fenny Megalia Handoko,Jakarta Timur,,,Restoran,10/50/B
Munik,Jl. Matraman Raya No. 82,PT.Sarimunik Mandiri,Muhamad Anwar Sandjaja,Jakarta Timur,021 85913109,021 85913103,Restoran,30/80/A
Oenpao,Jl. Boton Rest Area Tol Jagorawi,,Dian Yudistira Muskita,Jakarta Timur,,,Restoran,12/48/B
Palem Teras,Jl. Pulo Gadung Raya No. 18G,PT. Swadaya Agung Perkasa,Dewi Santri Hasan,Jakarta Timur,021 4602250,,Restoran,28/112/A
Pandan Hijau Resto,Jl. Pemuda No. 18,,Devi Kusumawati,Jakarta Timur,021 4758486,021 4758486,Restoran,20/50/B
Pari Mas,Jl. Pulomas Utara Raya No. 56,,Ertha Juliani,Jakarta Timur,021 4895418,021 4895418,Restoran,8/32/B
Persada,Jl. Raya Protokol Halim,BP Klub Eksekutif Persada Purnawira,Sudjono Shaleh,Jakarta Timur,021 8009121,,Restoran,20/80/A
Pizza Hut,Jl. Pendidikan I,PT. Sarimelati Kencana,Carolina Susanty,Jakarta Timur,,,Restoran,30/118/A
Pizza Hut,"Cibubur Junction, Jl. Raya Jambore No. 1",PT. Sarimelati Kencana,Carolina Susanty,Jakarta Timur,,,Restoran,24/96/A
Pizza Hut,Jl. Jatiwaringin Blok H-1 RT009/RW007,PT. Sarimelati Kencana,Carolina Susanty,Jakarta Timur,021 8306789,021 8306664,Restoran,150/75/A
Pizza Hut,Jl. Matraman Raya No. 37,PT. Sarimelati Kencana,Carolina Susanty,Jakarta Timur,021 8306789,021 8306790,Restoran,40/120/A
