nama_usaha,alamat_usaha,badan_usaha,penanggung_jawab,wilayah,no_telepon,no_fax,jenis_usaha,kapasitas
Killiney Kopitiam,Jl. Asia Afrika Lot. 19,PT. Astha Jaya Visaindo,Eka Constantin Satria Soepardijono,Jakarta Pusat,021 72781218,,Restoran,14/50/B
Kin No Taki,Jl. Tanjung Karang No. 2,PT. Ryori Nusantara,Arifin Siman,Jakarta Pusat,021 3920619,021 25536329,Restoran,30/132/A
Kin No Taki,Jl. Tanjung Karang No. 2,PT. Ryori Nusantara,Arifin Siman,Jakarta Pusat,021 3920619,021 25536329,Restoran,30/132/A
King Of Thai,Jl.MH.Thamrin Kav. 28-30,PT. Cipta Rasa Prosperindo,Afendy,Jakarta Pusat,021 3146086,,Restoran,10/40/B
Kinokawa,"Jl. MH.Thamrin Kav. 3, Kebon Sirih",PT. Adiwira Sempana,Alimansyah Haliman,Jakarta Pusat,021 3158877,021 3158875,Restoran,25/100/A
Kitchen 18,"Plaza BII, Jl. MH. Thamrin No. 51",PT. Cipta Daya Lestari,Andreas Sembiring,Jakarta Pusat,021 25558954,021 25558954,Restoran,10/40/B
Kitchenette,"Senayan City, Jl. Asia Afrika Lot. 19",PT. Kitchenette Lestari,Brian Ivan Sutanto,Jakarta Pusat,,,Restoran,15/50/B
Kiyadon Sushi,"Grand Indonesia, Jl. MH.Thamrin Kav.1",PT. Kaiten Jaya Abadi,Ramon B Liando,Jakarta Pusat,,,Restoran,10/40/B
Kiyadon Sushi,"Mal Senayan City, Jl. Asia Afrika Lot. 19",PT. Kaiten Jaya Abadi,Ramon B. Liando,Jakarta Pusat,021 5725246,021 72781778,Restoran,20/80/A
Klub Golf Senayan,"Jl. Asia Afrika, Pintu 9 Senayan",PT. Sinar Kemala Intermetro Golf,J.M. Wantah,Jakarta Pusat,021 571081,021 5710182,Restoran,40/160/A
Ko Iki,"Plaza Indonesia, Jl. MH. Thamrin Kav. 1",PT. Langgeng Cipta Selera,Rahadhi Arief Rachman,Jakarta Pusat,021 47928229,,Restoran,25/100/A
Koji,Jl. MH.Thamrin Kav.3,,Denny Ganda Soedibjo,Jakarta Pusat,021 39830033,,Restoran,10/40/B
Komala's Restaurant,"Gedung Sarinah, Jl. MH. Thamrin No. 11",PT. Graha Bhakti Semesta,Gurmeet Singh,Jakarta Pusat,021 3903533,021 3903534,Restoran,15/60/A
Komala's Restaurant,"Jl. MH. Thamrin No. 11, Gedung Sarinah",PT. Graha Bhakti Semesta,Gurmeet Singh,Jakarta Pusat,021 3903533,021 3903534,Restoran,15/60/A
Kopitiam,Jl. MH. Thamrin No. 1,PT. Bagus Kopitiam International,Norman Soelystio,Jakarta Pusat,,,Restoran,14/50/B
Krekot,Jl. Krekot Bunder No. 14,,Yong Fong Lien,Jakarta Pusat,021 3843972,,Restoran,12/48/B
Krispy Kreme,"Grand Indonesia, Jl. MH. Thamrin No. 1",PT. Premier Doughnut Indonesia,Ir. Jusroni,Jakarta Pusat,021 23580154,021 23580154,Restoran,11/33/B
Kuppa Restaurant,Jl. MH. Thamrin Kav. 28-30 Lt. 3,PT. Bina Pilarmas Pacific,Sumartono Mardjuki,Jakarta Pusat,021 39899116,021 39838788,Restoran,16/60/A
Kushi Musubi,"Gd. Citywalk Sudirman Lt. 1 Unit 10, Jl. KH. Mas Mansyur",PT. Musubi Sachi Indonesia,Nakamura Ryuji,Jakarta Pusat,021 25558672,021 25558673,Restoran,16/90/A
Kweetiauw Kerang Singapur,Jl. Teluk Betung No. 28,,Yuli Rahayu,Jakarta Pusat,,,Restoran,12/50/B
La Finestra Ristorante,Jl. Tanjung Karang No. 5,PT. Meranti Magsaysay,H. MA. Baheramansyah Djayanegara,Jakarta Pusat,021 3908812,021 3100289,Restoran,40/120/A
La Tour D'ebeya,Upper Ground,PT. Pacific Prime Ciusine,Eiko Okubo/Siti Aisja,Jakarta Pusat,021 25554265,021 25554266,Restoran,20/80/A
Lada Merah,Jl. MH. Thamrin Kav. 28 - 30,PT. Naga Merah Perkasa,Dewi Santri Hasan,Jakarta Pusat,021 29223877,,Restoran,15/60/A
Lamoda Café,Jl. MH. Thamrin Kav. 28-30,PT. Plaza Indonesia Realty Tbk,Drs. Mohamad Sjohirin,Jakarta Pusat,021 3901234,021 3903333,Restoran,25/108/A
Lan Na Thai,Jl. Dr. Kusuma Atmaja No. 85,PT. Triresto Muliatama,Haidhi Angkawijana,Jakarta Pusat,021 31925053,021 3143469,Restoran,20/80/A
Lara Djonggrang,Jl. Teuku Cik Ditiro No. 4,Melati Tanjungsari,Melati Tanjungsari,Jakarta Pusat,021 3153252,021 3160488,Restoran,15/70/A
Lattice Café,"Deutsche Bank Building, Jl. Imam Bonjol No. 80",PT. Boga Rembilan Sejati,Irene Affandy,Jakarta Pusat,021 8292587,021 8312722,Restoran,9/32/B
Lattice Café,"Deutsche Bank Building, Jl. Imam Bonjol No. 80",PT. Boga Rembilan Sejati,Irene Affandy,Jakarta Pusat,,,Restoran,9/32/B
Lau's Kopitiam,"Gd. Sarinah, Jl. MH. Thamrin No. 11",Ika Merdekawati Karkam,Ika Merdekawati Karkam,Jakarta Pusat,021 31923008,021 31931853,Restoran,10/50/B
Le Cafe Indonesia,"Jl. Jend. Sudirman, Bundaran Senayan",PT. Le Cafe Indonesia,Michael S. Rotinsulu,Jakarta Pusat,,,Restoran,14/45/B
Le Vintage Wine & Spirit,"Lotte Mart Ratu Plaza GF, Jl. Jend. Sudirman Kav. 9",PT. Dima Sicily Internasional,Iskandar Budianto,Jakarta Pusat,,,Restoran,8/40/B
Lintang 28,Jl. KH.Wahid Hasyim No. 74,Andryan Aminoto,Andryan Aminoto,Jakarta Pusat,021 3102002,021 3102002,Restoran,13/65/A
Little Penang,"FX Lifestyle Xnter, Jl. Jend. Sudirman, Pintu I Senayan",PT. Panca Mitrasari Lestari,Sumarno Ngadiman,Jakarta Pusat,021 25554600,021 25554601,Restoran,10/40/B
Little Sheep,"BRI II, Jl. Jend.Sudirman Kav. 42-43 No. 44-46 Lt.7",PT. Prima Selera,Srie Martina,Jakarta Pusat,021 57944281,021 57944282,Restoran,20/80/A
Liyen,Jl. Batu Tulis Raya No. 37,PT. Liyen Indonesia,Muliawan Jahja,Jakarta Pusat,,,Restoran,12/50/B
Locanda,"Gd. Bank Panin Pusat Lt. Ground, Jl. Jend. Sudirman 1",PT. Trimitra Boga Mandiri,Tonie Hartono Kadi,Jakarta Pusat,,,Restoran,38/88/A
Lollipop's Playland & Café,"Mal Senayan City, Jl. Asia Afrika Lot. 19",PT. Lollipop Indonesia,Tonie Hartono Kadi,Jakarta Pusat,021 72781648,021 72781649,Restoran,25/100/A
Long Beach Seafood,Jl. Asia Afrika Lt.-07B,PT. Elbe Seafood Indonesia,Milany Terianto,Jakarta Pusat,021 72781520,021 7233399,Restoran,69/300/A
Long Grain,Jl. New Delhi No. 9,PT. Bon Appetit,Agnes Jennifer Tanojo,Jakarta Pusat,021 5725254,021 5725367,Restoran,20/78/A
M. Ramen,"Sentral Senayan, Jl. Asia Afrika No. 8",PT. M. Ramen,Henky Lusli,Jakarta Pusat,,,Restoran,20/50/B
Mad For Garlic,"Grand Indonesia West Mall, Jl. MH.Thamrin No. 1",PT. Mas Millennium Indonesia,Roni Prananto,Jakarta Pusat,021 23581076,021 23581079,Restoran,30/120/A
Madame Lilys Café,Jl. Teluk Betung No. 41,PT. Credo Boga Makmur,Adhitya Roberto Fransiscus,Jakarta Pusat,,,Restoran,10/50/B
Madame Lilys Café,"Plaza Indonesia U L4#19 & L4#07A, Jl. MH. Thamrin",PT. Credo Boga Makmur,Adhitya Roberto Fransiscus,Jakarta Pusat,,,Restoran,15/50/B
Maimo Manado Resto Café,"FX Mall Sudirman Lat. F2/15, Jl. Jend. Sudirman",,Maja Thomas,Jakarta Pusat,021 25554557,021 25554557,Restoran,12/35/B
Makan Point,Jl. Batu Tulis Raya No. 22C,Wahyudi Sumali,Wahyudi Sumali,Jakarta Pusat,,,Restoran,10/50/B
Mamacita,"Mal Senayan City, Jl. Asia Afrika Lot. 9",PT. Cavallino Mitra Jaya,Tonie Hartono Kadi,Jakarta Pusat,021 57936171,021 57936173,Restoran,10/50/B
Mangia,"Grand Indonesia West Mall, Jl. MH. Thamrin No. 1",PT. Surya Lantar Asanka,Sim Fhiau,Jakarta Pusat,021 23580313,,Restoran,18/83/A
Marche,"Plaza Senayan, Jl. Asia Afrika No. 8",PT. Jayafood Indonesia,Ramon Benyamin Liando,Jakarta Pusat,,,Restoran,35/140/A
Marche Restaurant,"Grand Indonesia, Jl. MH. Thamrin No. 1",PT. Jayafood Indonesia,Ramon Benyamin Liando,Jakarta Pusat,,,Restoran,15/50/B
Margot,Jl. Jaksa No. 15C,PT. Margot Lestari,Halomoan Tambunan,Jakarta Pusat,021 3913830,021 31924641,Restoran,8/24/B
Mario's Place,Jl. Cikini Raya No. 2-4,PT. Mitratama Panganjaya,Arifin Adam,Jakarta Pusat,021 39831851,021 398331853,Restoran,30/120/A
Marugame Udon & Tempura,"Grand Indonesia, Jl. MH. Thamrin No. 1",PT. Sriboga Marugame Indonesia,Budi Setiawan,Jakarta Pusat,021 8306789,021 8306686,Restoran,50/100/A
Marutama Ra-Men,"Plaza Indonesia, Jl. MH. Thamrin Kav. 13",PT. M Ramen,Henky Rusli,Jakarta Pusat,021 5724050,021 5724050,Restoran,27/91/A
Master Wok,"Mal Senayan City Lt. 5 Unit 5-12, Jl. Asia Afrika Lot. 19",PT. Boga Makmur Wijaya,Kusnadi Rahardja,Jakarta Pusat,,,Restoran,10/30/B
Master Wok,"Plaza Senayan Lt. 3 Unit 337 C, Jl. Asia Afrika No. 8",PT. Boga Makmur Wijaya,Kusnadi Rahardja,Jakarta Pusat,,,Restoran,20/80/A
May Star,"Hotel Le Grendeur, Jl. Mangga Dua Raya",PT. Selera Sejahtera,Halim Juhanim,Jakarta Pusat,021 6127883,021 6127887,Restoran,35/350/A
Mc Donalds,"Sarinah, Jl. MH. Thamrin No. 11",PT. Rekso Nasional Food,Sukowati Sosrodjojo,Jakarta Pusat,,,Restoran,129/283/A
Mc Donalds,Jl. Hayam Wuruk No. 34-34A,PT. Rekso Nasional Food,Sukowati Sosrodjojo,Jakarta Pusat,,,Restoran,60/148/A
Mc Donald's,"ITC Cempaka Mas, Jl. Letjen. Suprapto",PT. Rekso Nasional Food,Sukowati Sosrodjojo,Jakarta Pusat,021 42879782,021 42879782,Restoran,23/46/B
Mc Donald's,"ITC Roxy Mas, Jl. KH. Hasyim Ashari No. 27",PT. Rekso Nasional Food,Sukowati Sosrodjojo,Jakarta Pusat,021 63857828,021 63857827,Restoran,25/100/A
Mc Donald's,"Mal Mangga Dua, Jl. Mangga Dua Raya",PT.Rekso Nasional Food,Sukowati Sosrodjojo,Jakarta Pusat,021 62301461,021 62301461,Restoran,120/240/A
Mc Donald's,Jl. Senen Raya No. 135,PT. Rekso Nasional Food,Sukowati Sasrodjojo,Jakarta Pusat,021 3856684,021 3856815,Restoran,33/119/A
Mc Donald's,"Plaza Senayan, Jl. Asia Afrika Unit 3",PT. Rekso Nasional Food,Sukowati Sosrodjojo,Jakarta Pusat,021 5725308,021 5725308,Restoran,40/120/A
Mc Donald's,Jl. Salemba Raya No. 31,PT. Rekso Nasional Food,Sukowati Sosrodjojo,Jakarta Pusat,021 45856199,021 45856191,Restoran,56/154/A
Mc Donald's,"STC Senayan, Jl. Asia Afrika",PT.Rekso Nasional Food,Sukowati Sosrodjojo,Jakarta Pusat,021 57936043,021 57936044,Restoran,70/144/A
Mc Donald's,Jl. Salemba Raya No. 31,PT. Rekso Nasional Food,Sukowati Sosrodjojo,Jakarta Pusat,021 45856199,021 45856191,Restoran,56/154/A
Mc Donald's,"Dharmala Cikini, Jl. Pegangsaan Timur No. 1A",PT. Rekso Nasional Food,Sukowati Sosrodjojo,Jakarta Pusat,021 45856222,021 45856333,Restoran,25/100/A
Mc Donald's,Jl. Letjen. Suprapto,PT. Rekso Nasional Food,Sukowati Sosrodjojo,Jakarta Pusat,021 42879782,021 42879782,Restoran,23/46/B
Mehbash,Jl. Kebon Kacang Raya No. 6,PT. Ref Sinergi Indonesia,Moh Rif'an,Jakarta Pusat,,,Restoran,20/60/A
Melly's,Jl. Kebon Sirih Timur Dalam No. 37-39,CV. Melly's Garden & Resto,Melly Saripah,Jakarta Pusat,021 3921333,021 3928228,Restoran,16/45/B
Melly's Garden & Resto,Jl. Wahid Hasyim No. 84-88,,Melly Saripah,Jakarta Pusat,021 91275753,021 91275753,Restoran,13/40/B
Melody House,Jl. Cikini Raya No. 2-4,PT. Daya Kreasi Komunika,Doening Sri Hidayati,Jakarta Pusat,021 3904888,021 39831877,Restoran,10/50/B
Melody House,Jl. Cikini Raya No. 2-4,PT. Daya Kreasi Komunika,Doening Sri Hidayati,Jakarta Pusat,021 3904888,021 39831877,Restoran,10/50/B
Melt,"BRI II Center Park, Jl. Jend. Sudirman Kav. 42-43",PT. Surya Mitra Lestari,Silvester Winarto,Jakarta Pusat,021 2512733,021 2512732,Restoran,27/77/A
Midori,Jl. KH. Wahid Hasyim No. 106,Ir. Hariono,Ir. Hariono,Jakarta Pusat,021 31489577,021 3900339,Restoran,16/77/A
Mikura Sushi & Sake,"Plaza Indonesia, Jl. M.H. Thamrin Kav. 28-30",PT. Andes Abadi,Nishida Emiko,Jakarta Pusat,021 29923670,021 29923671,Restoran,7/30/B
Mikura Sushi & Sake,"Plaza Indonesia, Jl. M.H. Thamrin Kav. 28-30",PT. Andes Abadi,Nishida Emiko,Jakarta Pusat,021 29923670,021 29923671,Restoran,7/30/B
Ming,"Mal Senayan City, Jl. Asia Afrika",PT. Victory Food Nusantara,"Rohmat, SE",Jakarta Pusat,021 72781627,021 72781627,Restoran,30/120/A
Miranda,Jl. Besuki No. 1 A RT003/RW005,Johnny Sardjono,Johnny Sardjono Boedi,Jakarta Pusat,,,Restoran,34/140/A
Misticanza,"Sahid Sudirman Residence, Jl. Jend.Sudirman ",PT. Karya Indo Selera,Ahmad Akbar,Jakarta Pusat,021 29022836,,Restoran,20/80/A
Mitra Oasis Residence,Jl. Senen Raya No. 135-137,PT. Sumbermitra Sarana Realtindo,Azis Chandra,Jakarta Pusat,021 3506970,021 3506975,Restoran,12/30/B
Molly Malone's,"Plaza Arcadia, Jl. New Delhi No. 9",PT. Indoerin,Irene Hanim,Jakarta Pusat,021 57901433,021 57901433,Restoran,15/80/A
Monolog,"Plaza Senayan, Jl. Asia Afrika No. 8 CP. 101B",PT. Gastronomica Indonesia,Haryadi Ridwan,Jakarta Pusat,021 5725144,021 5725146,Restoran,25/80/A
Morrissey,Jl. KH. Wahid Hasyim No. 70,PT. Icon Menara Samudera,Widijoso Sianandar,Jakarta Pusat,,,Restoran,12/50/B
Mos Burger,Jl. Asia Afrika No. 8,PT.MOG Indonesia,Pinnywati Chandra,Jakarta Pusat,,,Restoran,10/40/B
Mos Café,Jl. Asia Afrika No. 8,PT. MOG Indonesia,Pinnywati Chandra,Jakarta Pusat,,,Restoran,10/40/B
Moviez Resto & Coffee,Jl. Jend.Sudirman Kav. 2,PT.Semesta Sari Boga,M.Yusuf C.A,Jakarta Pusat,021 57939114,021 57939115,Restoran,40/150/A
Movina,"Plaza Indonesia, Jl. MH.Thamrin Kav. 28 - 30",PT. Svarna Movina,Vincent Surya Sianandar,Jakarta Pusat,,,Restoran,15/50/B
Mr. CURRY,Jl. MH. Thamrin No.1 3A Floor,PT. Wamaya Jaya,Brian Ivan Sutanto,Jakarta Pusat,021 23587000,021 23586000,Restoran,25/100/A
Mr. PARK,Jl. MH. Thamrin No. 1,PT. Little City,Sabirin Ariga Chaniago,Jakarta Pusat,021 93361931,,Restoran,14/28/B
My Pancake,"Grand Indonesia, Jl. MH.Thamrin No. 1",PT. Prioritas Prima Ideal,Arifin Leo,Jakarta Pusat,021 23580095,021 23580095,Restoran,17/68/A
Nakanakaya,"Gd. STC Senayan Lt. LG No. 106, Jl. Asia Afrika No. 1",PT. Sumiya Boga Lestari,Daniel,Jakarta Pusat,021 57932008,021 57932009,Restoran,15/80/A
Nan Xiang Steamed Bun,"Mal Senayan City, Jl. Asia Afrika Lot. 19",PT. Royal Cuisine Indonesia,Harsono Tjandra,Jakarta Pusat,021 72781621,021 72781621,Restoran,15/35/B
Nan Xiang Steamed Bun-Shanghai,Jl. Jend. Gatot Subroto,PT. Royal Cuisine Indonesia,Harry Prasetya Teo,Jakarta Pusat,021 5727257,021 4515846,Restoran,50/200/A
Nan Xiang Steamed Bun-Shanghai,"The Sultan Hotel, Jl. Jend. Gatot Subroto",PT. Royal Cuisine Indonesia,Harsono Tjandra,Jakarta Pusat,021 5727257,021 4515846,Restoran,50/200/A
Nannini,Jl. MH. Thamrin Kav. 28-30,PT. Marmitria Kafindo Sukses,Caroline Ruth Sumendap,Jakarta Pusat,021 57940981,021 57940982,Restoran,15/60/A
Nannini Grill,Jl. Asia Afrika No. 8,PT. Marmitria Kafindo Sukses,Caroline Ruth Sumendap,Jakarta Pusat,021 5725411,021 5725412,Restoran,30/150/A
Nanny's Pavillon,Jl. Kyai Haji Mas Mansyur No. 21,,Yaman Karyuda,Jakarta Pusat,,,Restoran,10/50/B
Nasi Uduk Kebon Kacang (Sancang),Jl. Samanhudi No. 12,PT.Usaha Bersaudara Resto,Tommy Djohan,Jakarta Pusat,,,Restoran,10/40/B
Natrabu,"Jl. KH. Agus Salim No. 29 A, Jl. Sabang ",PT. Natrabu Indah Agung,H. Rahimi Sutan,Jakarta Pusat,021 31935668,021 3100319,Restoran,28/56/A
Nelayan,"Gd. Manggala Wanabbhakti, Jl. Jend. Gatot Subroto",PT. Sangra Ratu Pratama,Aswan Kwek,Jakarta Pusat,021 5700248,021 5700227,Restoran,40/350/A
New Daisho Express,Jl. MH. Thamrin Kav. 1,PT. Putra Surya Makmur,Kusnadi Sukarja,Jakarta Pusat,021 23580957,,Restoran,5/24/B
Ni Hao,Jl. KH. Samanhudi No. 57,PT. Total Makmur Sentosa,Herry Sugandhi,Jakarta Pusat,021 3800448,021 38904162,Restoran,12/48/B
Ninety Nine,"East Mal Grand Indonesia, Jl. MH.Thamrin No. 1",PT. Supra Boga Lestari,Nugroho Setiadharma,Jakarta Pusat,,,Restoran,20/80/A
Nishiazabu Yukashi,Ratu Plaza Shopping Centre Lt. Dasar Unit G.0.0,PT. Yukashi Selera Gemilang,Shannon Masrin,Jakarta Pusat,,,Restoran,10/40/B
Nona Bola,Jl. HOS.Cokroaminoto No.90,Judy Soetaniman,Judy Soetaniman,Jakarta Pusat,021 31930486,021 31930486,Restoran,6/20/C
Nutz Culture,"Mal Senayan City, Jl. Asia Afrika Lot. 19",PT. Tri Tunggal Premium Entertainme,Indra Pramono Ekoputra,Jakarta Pusat,,,Restoran,16/105/A
Oasis,Jl. Raden Saleh No. 47,PT. Trasindo Oasis Enterprises,Oom Mucharam Endi,Jakarta Pusat,021 3150646,021 31937131,Restoran,51/204/A
Ocha & Bella,Jl. KH. Wahid Hasyim No. 70,PT. Svarna Kreasindo,Vincent Surya S,Jakarta Pusat,,,Restoran,12/48/B
Oenpao,Jl. MH. Thamrin No. 9,,Dian Yudhistira Mustika,Jakarta Pusat,,,Restoran,9/36/B
Olives,Jl. Imam Bonjol No. 76-78,PT. Fajar Prima Boga,Deepak Gordhan Samtani,Jakarta Pusat,021 3903615,021 3903614,Restoran,15/48/B
Olives,Jl. Imam Bonjol No. 76-78,PT. Fajar Prima Boga,Deepak Gordhan Samtani,Jakarta Pusat,021 3903615,021 3903614,Restoran,15/48/B
Omori,"Plaza BBD, Jl. Imam Bonjol No. 61",PT.Top Bread,Hami Wardimawati,Jakarta Pusat,021 3916337,021 3910026,Restoran,22/105/A
Ootoya,"Plaza Indonesia, Jl. MH.Thamrin Kav. 28-30",PT. Ootoya Indonesia,Hendra Rusli,Jakarta Pusat,,,Restoran,10/40/B
Opus Café,"Plaza Indonesia Unit L1, Jl. MH. Thamrin Kav. 28",PT. Boga Rembilan Sejati,Irene Affandy,Jakarta Pusat,021 3107553,021 3107553,Restoran,37/103/A
Orchardz,Jl. Pangeran Jayakarta Blok 44/7-8,PT. Gaya Wahana Inti,Juanda,Jakarta Pusat,021 6287888,021 6287888,Restoran,10/40/B
Orchardz,Jl. Industri Raya No. 8,PT. Kapuas Cemerlang Maju,Sugiarto Hardjo,Jakarta Pusat,021 62317788,021 62317788,Restoran,10/40/B
Orenji,Gd. TCC Batavia Tower One Basement 1 Unit 1,PT. Kawayama Orenji Indonesia,Inge Tanuwidjaya,Jakarta Pusat,021 29678233,,Restoran,10/40/B
Outback Steakhouse,"Ratu Plaza, Jl. Jend. Sudirman No. 9",PT. OBS Citra Indonesia,Prasoon Mukherjee,Jakarta Pusat,021 7252188,021 7257166,Restoran,20/196/A
Oyster,Jl. Asia Afrika No. 8,PT.Rumah Tiram,"Frederik Rosandi,SE",Jakarta Pusat,021 5725338,,Restoran,15/60/A
Padang Jaya Raya,Komp. Roxi Mas Blok D-3 Kav. 12a,,Ny. Yulianti,Jakarta Pusat,021 63858588,021 63858589,Restoran,15/60/A
Palalada,"Grand Indonesia, Jl. Kebon Kacang Raya Lt.3",PT. Alun Alun Indonesia Kreasi,Veronica Fausta W.S,Jakarta Pusat,021 23580870,,Restoran,60/140/A
Pancious Pancake,"Grand Indonesia West Mall Level 3A, Jl. MH. Thamrin",PT. Pancious Tirta Jaya,Fredy Tjong,Jakarta Pusat,021 23580936,,Restoran,10/50/B
Pancious Pancake House,Jl. Asia Afrika Lot. 19,PT. Pancious Tirta Jaya,Fredy Tjong,Jakarta Pusat,,,Restoran,20/100/A
Pancious Pancake House,"Plaza Indonesia, Jl. MH. Thamrin Kav. 28-30",PT. Pancious Tirta Jaya,Fredy Tjong,Jakarta Pusat,021 7990012,021 7990012,Restoran,20/80/A
Pandan Village,"Plaza Indonesia, Jl. MH. Thamrin Kav. 28-30 L3",PT. FG. Resto,David Hartono,Jakarta Pusat,021 3107272,021 3107644,Restoran,12/48/B
Paparon's Pizza,"Apartemen Park Royale, Jl. Jend. Gatot Subroto Kav. 35",PT. Eatertainment Indonesia,Oktobriana,Jakarta Pusat,021 91265917,021 91265917,Restoran,20/70/A
Paparon's Pizza,Jl. Gajah Mada Lt. Dasar No. 17-19,PT. Citra Boga Lestari,R. Prihandono Imam S.,Jakarta Pusat,021 63872132,021 63872134,Restoran,22/86/A
Paradise Dynasti,"Senayan Square, Jl. Asia Afrika No. 8",PT. Boga Makmur Dinasti,Kusnadi Rahardja,Jakarta Pusat,021 7235408,021 7235141,Restoran,20/80/A
Paradise Dynasty,"Plaza Senayan Lt. 5, Jl. Asia Afrika No. 8",PT. Boga Makmur Dinasti,Kusnadi Rahardja,Jakarta Pusat,021 7235408,021 7235141,Restoran,20/80/A
Paradise Inn,"Plaza Indonesia, Jl. MH. Thamrin Kav. 28-30",PT. Boga Makmur Intipangan,Kusnadi Rahardja,Jakarta Pusat,021 7235408,021 7235141,Restoran,20/80/A
Paramount,Jl. RP.  Soeroso No. 35,Joy Alamsjah,Joy Alamsjah,Jakarta Pusat,021 31923111,021 3151872,Restoran,20/151/A
Paregu,Jl. KH. Wahid Hasyim No. 41,PT. Mercucakra Windu,Arief Prijatna,Jakarta Pusat,021 3915456,021 7238942,Restoran,15/120/A
Pasta De Waraku,Jl. MH.Thamrin No. 1,PT.Wamaya Jaya,Brian Ivan Sutanto,Jakarta Pusat,021 23580916,021 23580916,Restoran,14/60/A
Pelangi,Jl. KH.Wahid Hasyim No. 108,,Barry Kurt,Jakarta Pusat,,,Restoran,15/50/B
Penang Bistro,Jl. Kebon Sirih No. 59,PT. Arena Gourmet,Michael Sofian Utomo,Jakarta Pusat,021 31906000,021 7260052,Restoran,30/250/A
Penang Bistro,"Grand Indonesia, Jl. MH. Thamrin No. 1 Unit",PT. Arena Gourmet,Michael Sofian Utomo,Jakarta Pusat,021 7260052,021 7260150,Restoran,18/96/A
Penang Eatery,"FX Lifestyle Xnter, Jl. Jend.Sudirman, Pintu I Senayan",PT. Panca Mitrasari Lestari,Sumarno Ngadiman,Jakarta Pusat,021 25554600,021 25554601,Restoran,22/50/B
Pepper Lunch,"FX Lifestyle Xnter Unit F2 # 07 Ot 07, Jl. Jend. Sudirman",PT. Boga Makmur Prima,Kusnadi Rahardja,Jakarta Pusat,021 7235408,021 7235141,Restoran,33/66/A
Pepper Lunch,"Jl. MH. Thamrin Kav. 28-30, Plaza Indonesia",PT. Boga Makmur Prima,Kusnadi Rahardja,Jakarta Pusat,021 3107621,021 3107622,Restoran,54/108/A
Pepper Lunch,"Senayan Square Complex, Jl. Asia Afrika No. 8",PT. Boga Makmur Prima,Kusnadi Rahardja,Jakarta Pusat,021 5725550,021 5725550,Restoran,44/88/A
Pepper Lunch,"Plaza Indonesia, Jl. MH. Thamrin Kav. 28-30",PT. Boga Makmur Prima,Kusnadi Rahardja,Jakarta Pusat,021 3107621,021 3107622,Restoran,54/108/A
Pepper Lunch,"Mall Senayan City Lt. 5, Jl. Asia Afrika Lot. 19",PT. Boga Makmur Prima,Kusnadi Rahardja,Jakarta Pusat,,,Restoran,10/40/B
Pepper Lunch,Jl. Asia Afrika,PT.Boga Makmur Prima,Kusnadi Rahardja,Jakarta Pusat,021 5725550,021 5725550,Restoran,10/40/B
Pesto Autentico,"ANZ Square Podium Lt.Upper Ground, Jl. MH. Thamrin",PT. Sahabat Prima Inti Niaga,Alvin Gozali,Jakarta Pusat,021 29937230,,Restoran,36/160/A
Phi Suki,Jl. MH. Thamrin No. 1,PT. Atrika Mizzatama,Winardi Hendrayanta,Jakarta Pusat,021 23580189,021 23580189,Restoran,10/40/B
Phloey,"Panin Bank Center, Jl. Jend. Sudirman Kav. 11",PT. Aneka Citra Laut,Andreas Yuwono,Jakarta Pusat,021 7394018,021 7261570,Restoran,28/125/A
Pho 2000,Jl. Asia Afrika Lot. 19,Lilia Dian Puspita Prananto,Lilia Dian Puspita Prananto,Jakarta Pusat,021 72781500,021 72781500,Restoran,8/34/C
Phoenam,Jl. KH. Wahid Hasyim No. 88,PT. Ibec Indonesia Ltd,Albert L,Jakarta Pusat,021 31924369,021 31924369,Restoran,4/12/C
Pisa Ice Cream,Jl. Gereja Theresia No. 1,PT. Boga Rahardjo Utama,Yerry Eka Nugraha,Jakarta Pusat,021 3100149,021 3152729,Restoran,30/120/A
Pizza Bar,Jl. MH.Thamrin No. 1,PT.Mitra Cipta Kreasi,Christianto Kesuma,Jakarta Pusat,021 23580929,,Restoran,9/36/B
Pizza E Birra,"Plaza Indonesia, Jl. MH. Thamrin Kav. 28-30",PT. Kharisma Birra Sejahtera,Christian Rijanto,Jakarta Pusat,021 3107272,021 3107644,Restoran,10/50/B
Pizza Hut,"Golden Truly, Jl. Gunung Sahari No. 59",PT. Sarimelati Kencana,Carolina Susanty,Jakarta Pusat,021 5706200,021 5706200,Restoran,11/132/A
Pizza Hut,"ITC Roxy, Jl. KH. Hasyim Ashari",PT. Sarimelati Kencana,Carolina Susanty,Jakarta Pusat,021 8306789,021 8306790,Restoran,30/80/A
Pizza Hut,"Menara Cakrawala, Jl. MH. Thamrin No. 9",PT. Sarimelati Kencana,Carolina Susanty,Jakarta Pusat,021 8306789,021 8306790,Restoran,33/56/A
Pizza Hut,"Mal Mangga Dua, Jl. Arteri Mangga Dua No. 47",PT. Sarimelati Kencana,Carolina Susanty,Jakarta Pusat,021 6126133,021 6126134,Restoran,30/68/A
Pizza Hut,"Grand Indonesia, Jl. MH. Thamrin No. 1",PT. Sarimelati Kencana,Carolina Susanty,Jakarta Pusat,,,Restoran,50/140/A
Pizza Hut,"Plaza Gajah Mada, Jl. Gajah Mada No. 19-26",PT. Sari Melati Kencana,Carolina Susanty,Jakarta Pusat,,,Restoran,30/118/A
Pizza Hut,Jl. MH. Thamrin Kav. 13,PT. Sarimelati Kencana,Carolina Susanty,Jakarta Pusat,,,Restoran,29/78/A
Pizza Hut,Jl. Ir. Juanda Raya No. 13 RT010/RW004,PT. Sarimelati Kencana,Carolina Susanty,Jakarta Pusat,,,Restoran,103/206/A
Pizza Hut,Jl. Cempaka Putih Raya No. 145,PT. Sarimelati Kencana,Carolina Susanty,Jakarta Pusat,021 8306789,021 8306790,Restoran,23/70/A
Pizza Hut,"Komp. Segitiga Senen, Jl. Senen Raya No. 135",PT. Sarimelati Kencana,Carolina Susanty,Jakarta Pusat,021 3459836,,Restoran,38/92/A
Pizza Hut,Jl. Asia Afrika No. 8,PT. Sarimelati Kencana,Carolina Susanty,Jakarta Pusat,,,Restoran,15/40/B
Pizza Hut,Jl. Asia Afrika Lot. 19,PT. Sarimelati Kencana,Carolina Susanty,Jakarta Pusat,021 72781404,021 72781405,Restoran,30/130/A
Pizza Hut,"ITC Cempaka Mas, Jl. Letjen. Suprapto",PT. Sarimelati Kencana,Carolina Susanty,Jakarta Pusat,,,Restoran,15/60/A
Pizza Hut,Jl. Asia Afrika No. 8,PT. Sarimelati Kencana,Carolina Susanty,Jakarta Pusat,,,Restoran,15/40/B
Pizza Hut,Jl. Bendungan Hilir Raya No. 31,PT.Sarimelati Kencana,Carolina Susanty,Jakarta Pusat,021 8306789,021 8306790,Restoran,10/50/B
Pizza Hut,Jl. Ir. Juanda Raya No. 13 RT010/RW004,PT. Sarimelati Kencana,Carolina Susanty,Jakarta Pusat,021 8306789,021 8306790,Restoran,103/206/A
Pizza Hut  Delivery,Jl. Pintu Air Raya No. 58-64,PT. Sarimelati Kencana,Carolina Susanty,Jakarta Pusat,021 8306789,021 8306790,Restoran,30/44/B
Pizza Hut Delivery,Jl. Bendungan Hilir Raya No. 104,PT. Sarimelati Kencana,Carolina Susanty,Jakarta Pusat,,,Restoran,4/12/C
Pizza Hut Delivery ( Phd ),Jl. Cempaka Putih Raya Blok C No. 23D,PT. Sarimelati Kencana,Carolina Susanty,Jakarta Pusat,,,Restoran,4/12/C
Pizza Hut Delivery ( Phd ),Jl. Kebon Kacang Raya,PT. Sarimelati Kencana,Carolina Susanty,Jakarta Pusat,,,Restoran,4/12/C
Pizza Hut Delivery ( Phd ),"Thamrin Residence, Jl. Kebon Kacang Raya",PT. Sarimelati Kencana,Carolina Susanty,Jakarta Pusat,,,Restoran,4/12/C
Pizza Hut Delivery (Phd),Jl. KH. Hasyim Ashari No. 27 RT004/RW005,PT. Sarimelati Kencana,Carolina Susanty,Jakarta Pusat,021 8306789,021 8306664,Restoran,5/15/C
Pizza Hut Delivery (Phd),Jl. Cikini Raya No. 81A,PT. Sarimelati Kencana,Carolina Susanty,Jakarta Pusat,021 8306789,021 8306790,Restoran,6/19/C
Pizza Marzano,"Senayan City Mal, Jl. Asia Afrika Lot. 19",PT. Sari Pizza Indonesia,Indrawana Widjaja,Jakarta Pusat,021 72781065,021 72781066,Restoran,20/50/B
Pizza Marzano,"Foodhall Grand Indonesia, Jl. MH. Thamrin No. 1",PT. Sari Pizza Indonesia,Jusroni,Jakarta Pusat,021 5746501,021 5746189,Restoran,15/60/A
Pizza Marzano,Jl. Asia Afrika Lot. 19,PT. Sari Pizza Indonesia,Indrawana Widjaja,Jakarta Pusat,021 72781065,021 72781066,Restoran,20/50/B
Pizza Marzano,"City Lofts, Jl. KH.Mas Mansyur No. 121",PT. Sari Pizza Indonesia,Indrawana Widjaja,Jakarta Pusat,,,Restoran,33/79/A
Pizza Marzano,"City Lofts, Jl. KH.Mas Mansyur No. 121",PT. Sari Pizza Indonesia,Indrawana Widjaja,Jakarta Pusat,,,Restoran,33/79/A
Platinum,"Plaza Gajah Mada, Jl. Gajah Mada No. 19-26",PT. Champ Resto Indonesia,Ali Gunawan Budiman,Jakarta Pusat,021 021-1408,,Restoran,10/40/B
Platinum,"Atrium Plaza, Jl. Senen Raya No. 135",PT. Champ Resto Indonesia,"Drs. Yunus Ciptawilangga, MBA",Jakarta Pusat,021 39918587,021 39918587,Restoran,15/60/A
Poke Sushi,"Grand Indonesia, Jl. MH.Thamrin No. 1",PT. Wahana Sapta Karya,Donny Halim,Jakarta Pusat,,,Restoran,5/20/B
Polo Club Jakarta,Jl. KH.Mas Mansyur Kav. 124,PT. Graha Buana Cikarang,Ninik Triwahyuni,Jakarta Pusat,021 5723767,021 5723767,Restoran,14/60/A
Polo Lounge,"Menara Batavia Lt. 2, Jl. KH. Mas Mansyur Kav. 1",PT. Mahameru Adiceria,Budhy Kurniawan Ratulangi,Jakarta Pusat,021 5723767,021 5723767,Restoran,15/50/B
Pondok Angkasa,Jl. Angkasa Raya No. 32,,Judy Tjahaya,Jakarta Pusat,,,Restoran,10/40/B
Pondok Djaja,Jl. Hayam Wuruk No. 11,Lani Widjaja,Lani Widjaja,Jakarta Pusat,021 3506182,021 3506182,Restoran,10/36/B
Pondok Iga,"Mal Senayan City, Jl. Asia Afrika Lot. 19",PT. Pondok Iga,Petty Suwito,Jakarta Pusat,,,Restoran,10/50/B
