nama_usaha,alamat_usaha,badan_usaha,penanggung_jawab,wilayah,no_telepon,no_fax,jenis_usaha,kapasitas
1001 Entertainment Club,"Jl. Kunir No. 7, Pinangsia",PT. Perkasa Tunggal Mandiri,Stanislaus Raymer Jacob,Jakarta Barat,021 6907575,021 6907575,Restoran,10/50/B
9 Square Pool & Resto,Jl. Anggrek Cakra No. 7 RT004/RW006,PT. Linijati Arthaprima,Novarmi Bakti Massewa,Jakarta Barat,021 53691026,021 53691029,Restoran,48/123/A
99.0,Jl. Mangga Besar Raya No. 2B,Martin Santoso,Martin Santoso,Jakarta Barat,021 6291419,021 6291419,Restoran,16/80/A
A & W Family,"Jl. Kamal Raya Outer Ring Road, Cengkareng",PT. Prima Usaha Era Mandiri,Zaina Siman,Jakarta Barat,,,Restoran,10/40/B
A & W Family,Jl. Pancoran No. 23,PT. Prima Usaha Era Mandiri,Zaina Siman,Jakarta Barat,,,Restoran,10/40/A
A & W Family,"Roxi Square, Jl. Kyai Tapa 1 RT001/RW011",PT. Prima Usaha Era Mandiri,Zaina Siman,Jakarta Barat,021 6623456,021 66605852,Restoran,15/60/A
A & W Family,Jl. Mangga Besar Raya No. 81,PT. Prima Usaha Era Mandiri,Zaina Siman,Jakarta Barat,,,Restoran,10/40/B
A & W Family,"Ruko Meruya One Unit 1B,1C,1D, Jl. Meruya Ilir",PT. Prima Usaha Era Mandiri,Zaina Siman,Jakarta Barat,,,Restoran,10/40/B
A & W Family,"Matahari Mal, Jl. Daan Mogot Km. 15,6",PT. Prima Usaha Era Mandiri,Zaina Siman,Jakarta Barat,021 6623456,021 66605852,Restoran,8/15/C
A & W Family,Jl. Tomang Tol Raya Blok I No. 23-25,PT. Prima Usaha Era Mandiri,Zaina Siman,Jakarta Barat,021 6623456,021 66605852,Restoran,15/60/A
A & W Family,"Mal Ciputra LG 43, Jl. Letjen.S. Parman",PT. Biru Fast Food Nusantara Ltd.,Zaina Siman,Jakarta Barat,021 5606056,021 5606082,Restoran,40/80/A
A & W Family,"Stasiun KA Beos, Jl. Taman Stasiun Kota",PT. Biru Fast Food Nusantara Ltd,Zaina Siman,Jakarta Barat,,,Restoran,20/60/A
A & W Family,"Seasons City, Jl. Prof. Dr. Latumenten No. 33",PT. Prima Usaha Era Mandiri,Zaina Siman,Jakarta Barat,021 6623456,021 6624232,Restoran,10/40/B
A & W Family,"Gd. Carrefour, Jl. Puri Kembangan B.Q/1",PT. Prima Usaha Era Mandiri,Zaina Siman,Jakarta Barat,021 5819590,021 5820394,Restoran,15/60/A
A & W Family,"Mal Puri Indah Lt. 2, Jl. Puri Indah Raya",PT. Prima Usaha Era Mandiri,Zaina Siman,Jakarta Barat,021 6623456,,Restoran,10/40/B
A & W Family,"Roxy Square, Jl. Kyai Tapa 1 RT. 01/11",PT. Prima Usaha Era Mandiri,Zaina Siman,Jakarta Barat,,,Restoran,15/60/A
A & W Family,"Mall Taman Anggrek, Jl. Letjen. S. Parman",PT. Biru Fast Food Nusantara,Zaina Siman,Jakarta Barat,021 6623456,021 5639381,Restoran,10/40/B
Abuba Steak,Jl. Gajah Mada No. 149D,PT. Abuba,Muhammad Ali Ariansyah,Jakarta Barat,,,Restoran,10/40/B
Abuba Steak,"Ruko Gajah Mada, Jl. Gajah Mada No. 149D",PT. Abuba,Muhammad Ali Ariansyah,Jakarta Barat,,,Restoran,10/40/B
Abuba Steak,Komp. Green Ville Blok AS No. 30,PT. ABUBA,Muhamad Ali Ariansyah,Jakarta Barat,,,Restoran,12/45/B
Ah Mei Cafe,"Mal Puri Indah, Jl. Puri Agung",PT. Banquet Eaton Indonesia,Halim Susanto,Jakarta Barat,021 5606948,021 5606948,Restoran,10/20/B
Ajisen,Jl. Puri Agung,PT. Panca Gitasari Lestari,Teddy Harsono,Jakarta Barat,,,Restoran,10/50/B
Ajisen Ramen Rest,"Mal Taman Anggrek, Jl. Letjen.S.Parman",PT. Panca Mitrasari Lestari,Sumarno Ngadiman,Jakarta Barat,,,Restoran,15/40/B
American Grill,"Mal Taman Anggrek, Jl. Letjen.S Parman",PT. Bestfoods Nusantara,Arifin Siman,Jakarta Barat,021 35004567,021 35004567,Restoran,48/192/A
American Grill,Jl. Tomang Raya No. 51,PT. Super Utama Nusantara,Arifin Siman,Jakarta Barat,021 3500123,021 2310312,Restoran,15/50/B
Angke,Jl. KH. Zainul Arifin Blok I/1-3,PT. Angke Maju Makmur,Lie Peter Leeansyah,Jakarta Barat,021 6343030,021 6343030,Restoran,40/400/A
Apollo Kitchen,Jl. Letjen. S.Parman Kav. 21,,Chandra Supandiwijaya,Jakarta Barat,,,Restoran,10/50/B
Apollo Kitchen,Jl. Letjen. S.Parman Kav. 21,,Chandra Supandiwijaya,Jakarta Barat,,,Restoran,10/50/B
Aroma Pondok Sunda,Jl. Letjen. S.Parman Kav. 21,Petty Suwito,Petty Suwito,Jakarta Barat,,,Restoran,10/50/B
Ayam Goreng Ny. Suharti,Jl. Tomang Raya No. 54,,Sjahlan Prapto Harjono,Jakarta Barat,,,Restoran,10/40/B
Ayam Goreng Ny. Suharti,Jl. Pesanggrahan No. 15A,,Suharti,Jakarta Barat,021 5806212,021 5806212,Restoran,20/100/A
Ayam Goreng Seleraku,Jl. Mangga Besar Raya No. 17,Andrik Tanuwijaya,Andrik Tanuwijaya,Jakarta Barat,021 6297158,021 6281191,Restoran,12/50/B
Ayam Tulang Lunak Hayam Wuruk,Jl. Ruko Permata Lokasari Blok C 1-2,PT. Citarasa Investama,Kurniadi Cahyono,Jakarta Barat,021 4507855,021 4507855,Restoran,10/40/B
B Fashion,Jl. Aranda No. 1,PT. Tumbuh Sukses Makmur,Wedji Hartono P,Jakarta Barat,,,Restoran,10/100/A
Bakerzin,"Central Park, Jl. Letjen. S. Parman Kav. 28 GF-G",PT. Boga Makmur Mandiri,Kusnadi Rahardja,Jakarta Barat,,,Restoran,15/50/B
Bakmi Ayam Alok,Jl. Mangga II B-38,Akmal,Akmal,Jakarta Barat,,,Restoran,12/72/A
Bakmi Gang Kelinci,Jl. Tanjung Duren Utara I,Padmawati Dharmawan,William Roy,Jakarta Barat,021 5606572,,Restoran,50/200/A
Bakmi Gang Kelinci,"Mutiara Taman Palem, Jl. Lingkar Luar Barat A.18/2-3",Kenny Sukiman,Kenny Sukiman,Jakarta Barat,021 6192288,021 6192288,Restoran,5/20/B
Bakmi Gm,"Mal Taman Anggrek, Jl. Letjen. S. Parman Kav. 2",PT. Griya Miesejati,Peily Dian Lie,Jakarta Barat,021 56699328,021 56699329,Restoran,35/140/A
Bakmi Gm,"Jl. Gajah Mada No. 92, Krukut",PT. Griya Miesejati,Peily Dian Lie,Jakarta Barat,021 6334689,021 6334689,Restoran,30/120/A
Bakmi Gm,"Mal Puri Indah, Jl. Puri Agung Raya",PT. Graha Murni Rasa,Ferdy Pattiasina,Jakarta Barat,021 5822406,021 5655001,Restoran,40/160/A
Bakmi Gm,"Citra Garden City, Citra 6 Blok LA",PT. Griya Miesejati,Peily Dian Lie,Jakarta Barat,021 5655008,021 5655001,Restoran,30/120/A
Bakmi Mangga Besar Viii,Jl. Mangga Besar VIII/12,Ruslim Limawal,Ruslim Limawal,Jakarta Barat,,,Restoran,10/60/A
Bakso Malang,"Mal Taman Anggrek, Jl. Letjen. S. Parman",PT. Champ Resto Indonesia,"Drs. Yunus Ciptawilangga, MBA",Jakarta Barat,021 5639542,021 5639354,Restoran,20/60/A
Bakso Malang Karapitan,"Mal Ciputra, Jl. Tanjung Duren Barat",PT. Champ Resto Indonesia,Yunus Ciptawilangga,Jakarta Barat,,,Restoran,12/50/B
Bar B.Q Plaza,"Mal Puri Indah, Jl. Puri Indah Raya",PT. The Barbecue Plaza,Kelvin Danieli Suhendra,Jakarta Barat,,,Restoran,15/50/B
Baso Malang Karapitan,"Plaza Slipi Jaya, Jl. Letjen.S.Parman Lt. 1 Kav. 1",PT. Champ Resto Indonesia,Ali Gunawan Budiman,Jakarta Barat,021 7996703,,Restoran,30/80/A
Beanstro,"Puri Indah Mall, Jl. Puri Agung",PT. Trans Coffee,Fransiscus Sumampow,Jakarta Barat,,,Restoran,10/40/B
Bearly,Jl. Tanjung Duren Barat III No. 1,PT. Ciko Pelangi Nada,"Tjoeng Tjiang Hie, SE",Jakarta Barat,,,Restoran,10/40/B
Bengkong Laut,Jl. Duri Kosambi Raya Blk C/1B,,Rudi Pranata Tjoa,Jakarta Barat,021 99110111,,Restoran,14/50/B
Biero,Citra 6 Blok J.5.A No. 10 RT003/RW015,PT. Citra Sukses Bogarasa,Tommy,Jakarta Barat,,,Restoran,15/70/A
Bima,"Mal Ciputra Lantai V Unit 31 A, Jl. Arteri. S. Parman",PT. Nav Bima Pratama,Jakub Setjoatmadja,Jakarta Barat,021 5662277,021 5661390,Restoran,10/50/B
Black Ball,"Central Park Lt. 1, Jl. Letjen. S. Parman Kav. 28",PT. Fresco,Ledianto Darwinto Tjhin,Jakarta Barat,021 29200213,021 29200213,Restoran,10/20/B
Bliss Garden,Jl. Gajah Mada No. 82,Titus Yuwono,Titus Yuwono,Jakarta Barat,,,Restoran,15/50/B
Blitzmegaplex,"Central Park, Jl. Letjend S.Parman Kav. 28",PT. Graha Layar Prima,Bratanata Perdana,Jakarta Barat,021 56988888,021 56985100,Restoran,12/48/B
Bon Chon Chicken,Jl. Letjen. S.Parman Kav. 21 UGL T09,PT. Michelindo Food International,Michelle Elizabeth,Jakarta Barat,,,Restoran,10/50/B
Bon Chon Chicken,Jl. Letjen. S.Parman Kav. 21 UGL T09,PT. Michelindo Food International,Michelle Elizabeth,Jakarta Barat,,,Restoran,10/50/B
Bonchon Chicken,"Jl. Letjen.S.Parman, Jl.Tanjung Duren Raya",PT. Michelindo Food International,Michelle Elizabeth,Jakarta Barat,,,Restoran,12/42/B
Breakfast Lunch Dinner,Jl. Puri Indah Boulevard Blok U1,PT. Nashville International,Nikko Wonoto,Jakarta Barat,021 55777775,021 55777775,Restoran,20/80/A
Brooaster Chicken,Jl. Daan Mogot,PT. Usaha Sari Boga,Edi Amin,Jakarta Barat,,,Restoran,10/40/B
Brooaster Chicken,Jl. Arteri S. Parman Lt.V Unit 22B,PT. Usaha Sari Boga,Edi Amin,Jakarta Barat,,,Restoran,14/60/A
Brussels Spring,"Central Park, Jl. Letjen.S.Parman",CV. Anugrah Bersama,Bert Melvin,Jakarta Barat,021 29200008,021 29200008,Restoran,10/32/B
Brussels Spring,"Central Park, Jl. Letjen.S.Parman",CV. Anugrah Bersama,Bert Melvin,Jakarta Barat,021 29200008,021 29200008,Restoran,10/32/B
Bullfrog,Jl. Raya Pejuangan No. 21,Ir. Pudjiarso H. Prakoso,Ir.Pudjiarso H.Prakoso,Jakarta Barat,021 5323769,021 5323769,Restoran,5/20/B
Bumbu Desa,Jl. Raya Panjang No. 10,Nurcahya Arianegara,Nurcahya Arianegara,Jakarta Barat,,,Restoran,30/120/A
Burger King,"Mall Ciputra LG, Jl. Letjen S. Parman",PT. Sari Burger Indonesia,Jusroni,Jakarta Barat,021 5607588,021 56954880,Restoran,15/60/A
Burger King,"Puri Indah Mall Lt. 2 Unit 232-232A-233, Jl. Puri A",PT. Sari Burger Indonesia,Jusroni,Jakarta Barat,021 5822608,021 5822454,Restoran,20/100/A
Burger King,Jl. Letjen. S. Parman Kav. 28,PT. Sari Burger Indonesia,Jusroni,Jakarta Barat,021 56985601,021 56985601,Restoran,10/50/B
Burger King,"Hayam Wuruk Plaza GF, Jl. Hayam Wuruk No. 1",PT. Sari Burger Indonesia,Jusroni,Jakarta Barat,021 6241080,021 6241080,Restoran,51/222/A
Burger King,Central Park LG. 248 Jl. Letjen. S. Parman,PT. Sari Burger Indonesia,Jusroni,Jakarta Barat,021 56985601,021 56985601,Restoran,10/50/B
Café & Resto Pisa Puri,Ruko Puri Kencana Blok L6 No. 88,PT. Agung Bestfood Raya,Gunardi Taniwan,Jakarta Barat,021 58302666,021 5828999,Restoran,10/50/B
Café De Waraku,Jl. Letjen. S.Parman Kav. 21,Petty Suwito,Petty Suwito,Jakarta Barat,,,Restoran,10/50/B
Café De Waraku,Jl. Letjen.S.Parman Kav. 21,Petty Suwito,Petty Suwito,Jakarta Barat,,,Restoran,10/50/B
Cahaya Baru,"Jl. Tiang Bendera II / 84, Roa Malaka",Hengky Dompas,Hengky Dompas,Jakarta Barat,021 6900766,021 6900766,Restoran,24/140/A
Cahaya Baru,Jl. Tiang Bendera II No. 84,CV. Cahaya Baru,Hengky Dompas,Jakarta Barat,021 6900766,021 6930705,Restoran,24/140/A
California Pizza Kitchen,"PX Pavilion @ The St. Moritz, Jl. Puri Indah Raya",PT. Panca Pilar Kencana,Roni Prananto,Jakarta Barat,,,Restoran,34/116/A
Canton Bay,Jl. Jend. S. Parman,PT. Panca Mitrasari Lestari,Sumarno Ngadiman,Jakarta Barat,021 5639128,021 5639128,Restoran,25/110/A
Canton Bay,Jl. Puri Agung,PT. Panca Mitrasari Lestari,Sumarno Ngadiman,Jakarta Barat,,,Restoran,10/50/B
Carl's Jr,"Central Park, Jl. Letjen. S. Parman Kav. 28",PT. Generasi Mutiara Bangsa,Irza Hanafiah Pulungan,Jakarta Barat,021 29200090,021 29200091,Restoran,14/50/B
Carming,Komplek Green Garden Blok Y 3/64,,Herry Kartio,Jakarta Barat,021 5502721,,Restoran,8/40/B
Causeway Bay Hk Resto,Jl. Gajah Mada No. 174,PT. Causeway Bay Resto,Lam Saila Angela,Jakarta Barat,021 6319333,021 6683711,Restoran,8/58/A
Celio Cafe,"Perkantoran Kencana, Taman Aries Blok D1/3 U-CD ",PT. Inspirasindo,Melanie Mokoagow,Jakarta Barat,021 5857382,021 5857376,Restoran,12/50/B
Cempaka,Perum Citra 2 Ext Blok BG-3B No.31,PT.Mulia Agung Abadi,I Ketut Sumerta Wijaya,Jakarta Barat,021 54377449,,Restoran,10/40/B
Cendana,Jl. Raya Pos Pengumben No. 11,Drs.Syed Abubakar,Drs.Syed Abubakar,Jakarta Barat,021 5840670,021 5840670,Restoran,10/50/B
Cendana,Jl. Raya Pos Pengumben No. 11,Drs.Syed Abubakar,Drs.Syed Abubakar,Jakarta Barat,021 5840670,021 5840670,Restoran,10/50/B
Central,Jl. Latumeten No. 33,PT. Central Sukses Bersama,Alex,Jakarta Barat,021 29071333,021 29071355,Restoran,35/300/A
Cfc,Jl. Aipda KS. Tubun No. 92 - 94,PT. Pioneerindo Gourmet International,Kusuwandi Tamin,Jakarta Barat,,,Restoran,25/100/A
Cfc,"Plaza Slipi Jaya, Jl. Letjen S. Parman Kav. 17-18",PT. Pioneerindo Gourmet Intl,Kusuwandi Tamin,Jakarta Barat,021 5250275,,Restoran,51/102/A
Chatterbox Cafe,"The Foodhall, Jl. Perjuangan Raya Kedoya",PT. Sari Boga Lestari,Susan Logawa,Jakarta Barat,021 5722048,021 5722045,Restoran,25/80/A
Chatterbox Café,"Central Park, Jl. Tanjung Duren Raya",PT. Sari Boga Lestari,Indrawan Widjaja,Jakarta Barat,021 5722048,021 5722045,Restoran,60/180/A
Cheese Cake Factory,Jl. Tomang Raya No. 41,PT. Desserta Factori Gelato,De Selva U Chandra Sri Lal,Jakarta Barat,,,Restoran,20/80/A
Chef Yang,"Jl. Kintamani Raya, Jl. Tanah Lot",PT. Abdi Manunggal,Fabian,Jakarta Barat,,,Restoran,15/50/B
Chefs Table,"Mall Puri Indah, Jl. Puri Agung Raya",PT. Dhana Makmur Cemerlang,DENDY SJAHADA H,Jakarta Barat,,,Restoran,15/60/A
Chicken Story,"Mal Ciputra, Jl. Letjend. S. Parman",PT. Prime Restaurant Indonesia,Harry Sanusi,Jakarta Barat,,,Restoran,20/40/B
Chinese Food,St. Moritz Mall Lantai 2 No. 50 RT002/RW002,PT. Nihao Jaya Makmur,Herry Sugandhi,Jakarta Barat,,,Restoran,12/72/A
City Extra,Jl. Tanjung Duren Raya No. 1G RT003/RW005,PT. Tritunggal Jaya Cemerlang,Janto,Jakarta Barat,,,Restoran,10/50/B
City Hall Kedai Kopi,Jl. Hayam Wuruk No. 72,PT. City Selera Indo,Ahmad Suseno,Jakarta Barat,,,Restoran,14/50/B
Clover Palace,Jl. Letjen. S.Parman Kav. 28,PT. Deca Mandiri,Mahdiana,Jakarta Barat,021 56985318,021 56985318,Restoran,15/60/A
Club 36,Jl. Hayam Wuruk No. 126,PT. Paramita Inti Utama,Boyke Jatikusuma,Jakarta Barat,021 6269666,021 6267666,Restoran,20/80/A
Club Nebula,"Central Park Mall Lt. 8 Lot 3A, Jl. Letjend S. Parman",PT. Nebula Interten,Irwan Gunawan Lie,Jakarta Barat,,,Restoran,25/65/A
Coca Suki,Jl. Raya Perjuangan No. 1,PT. Boga Selera Perdana,Henny Hidayat,Jakarta Barat,021 5713688,021 5713687,Restoran,31/110/A
Coral Bistro,"Komp. Graha Mas Blok B.25, Jl. Raya Perjuangan ",Ferry Laksana,Ferry Laksana,Jakarta Barat,021 5302840,021 5302876,Restoran,10/60/A
Crystal Jade La Mian,"Ranch Market Headquarter, Jl. Pesanggrahan Raya",PT. Crystal Jade La Miab Xiao Long B,Shannon Masrin,Jakarta Barat,021 6919618,021 6900723,Restoran,20/80/A
Culina,Jl. Pesanggrahan No. 8,PT. Selera Kian Makmur,Lin Manuhutu,Jakarta Barat,,,Restoran,25/65/A
Cut & Grill,"The Bale Kawasan Daan Mogot Baru C1-C2, Jl. Daan Mogot Raya KM. 16",PT. Karnivora Maju Terus,Ridwan Kumala,Jakarta Barat,,,Restoran,15/60/A
D' Asti Wines And Spirits Lounge,"ST. Moritz Puri Indah Lt. G, Jl. Komp. Perum Puri",PT. Mitra Kreasi Kuliner,Irwan Gunawan Lie,Jakarta Barat,,,Restoran,2/4/C
D' Core,Jl. Letjen. S.Parman Kav. 72,CV. Anak Muda Pinter Makan,Yossita Kurniawan,Jakarta Barat,,,Restoran,15/50/B
D' Cost,"Seasons City, Jl. Prof. Dr. Latumenten No. 33",PT. Pendekar Bodoh,David Vincent Marsudi,Jakarta Barat,021 7342003,021 7342003,Restoran,20/50/B
D' Cost,"Ciputra Mal, Jl. Letjend S. Parman",PT. Atcost Beta,David Vincent Marsudi,Jakarta Barat,021 7342003,021 7342003,Restoran,14/50/B
D' Cost,"Gd. House of Blessing, Jl. Lingkar Luar Barat No. 108",PT. Pendekar Bodoh,David Vincent Marsudi,Jakarta Barat,,,Restoran,12/50/B
D' Cost,"Mal Matahari, Jl. Daan Mogot Raya KM.16",PT. Pendekar Bodoh,David Vincent Marsudi,Jakarta Barat,,,Restoran,14/50/B
D' Omelette,Jl. Hayam Wuruk No. 126,,Herrijanto Widjaja,Jakarta Barat,021 6390951,021 6390951,Restoran,14/56/A
Da Fu Hao,Jl. Hayam Wuruk No. 72,PT. Banyu Biru Pratama,Liauw Beng Tjoan,Jakarta Barat,,,Restoran,10/40/B
Dabes Burger,Jl. Hayam Wuruk No. 108,,Royandi Santoso,Jakarta Barat,021 6498285,,Restoran,9/31/B
Daniang Dumpling,Jl. Letjen. S.Parman,PT. Daniang Dumpling,Chris Sanjaya,Jakarta Barat,021 56998426,,Restoran,20/80/A
Dante Coffee,Jl. Letjen.S.Parman Kav. 28,PT. Royal Jaya Sentral,Rivano Januar Susilo,Jakarta Barat,021 56985763,021 56985762,Restoran,15/50/B
Dante Coffee,Jl. Letjen.S.Parman Kav. 28,PT. Royal Jaya Sentral,Rivano Januar Susilo,Jakarta Barat,021 56985763,021 56985762,Restoran,15/50/B
Dapur Betawi Mpok Juju,Jl. E Ujung No. 8 RT002/RW003,,Hj. Djubaedah,Jakarta Barat,,,Restoran,10/50/A
Dapur Kuring,Jl. Letjen. S. Parman Kav. 57,,Nursianti Margaret,Jakarta Barat,,,Restoran,12/48/B
De Rivier,Jl. Kali Besar Barat No. 44 - 46,PT. Wahana Andamari,Drs. Fuad Djapar,Jakarta Barat,021 6904118,021 6912894,Restoran,20/100/A
Delta Raya Pratama,Komplek Mutiara Taman Palem Blok C 1 No. 1,CV. Delta Citra Palma Fortuna,Simon Prasetio Liauw,Jakarta Barat,021 54355999,021 54356000,Restoran,10/80/A
Delta Spa,"Prisma Kedoya Plaza, Jl. Raya Perjuangan",PT. Puri Karya Jaya Sentosa,Simon Prasetio Liauw,Jakarta Barat,021 5363545,,Restoran,4/16/C
Depot 369,Jl. Mangga Besar Raya No. 57A,,,Jakarta Barat,,,Restoran,18/98/A
Dharma Kitchen Indonesia,"Central Park, Jl. Letjen. S.Parman",PT. Dharma Kitchen Indonesia,Toni Widjaja,Jakarta Barat,021 29200018,021 29200018,Restoran,16/50/B
Dharma Kitchen Indonesia,Jl. Letjen. S.Parman,PT. Dharma Kitchen Indonesia,Toni Widjaja,Jakarta Barat,021 29200018,,Restoran,16/50/B
Diamond Executive Club,"Pertokoan Glodok Blustru, Jl. Blustru Lt. 7",PT. Diamond Tirtajaya,Kwok Chandra Kusnadi,Jakarta Barat,021 6253488,,Restoran,20/80/A
Dian Xiao Er,Jl. Letjen. S.Parman Kav.21,PT. Jaya Indomatrix Abadi,Ramon B Liando,Jakarta Barat,021 5639679,,Restoran,20/80/A
Din Tai Fung,"Mal Taman Anggrek, Jl. Letjen. S. Parman",PT. Dhanamakmur Cemerlang,Dendy Sjahada H,Jakarta Barat,021 55911050,021 55911051,Restoran,15/50/A
Dinar,Jl. Lingkar Luar Kamal Blok B17,Sutiati,Sutiati,Jakarta Barat,,,Restoran,10/50/B
District  7,"Apartemen Westmark, Jl. Tanjung Duren Selatan",-,Robert Marudut Napitupulu,Jakarta Barat,,,Restoran,19/80/A
Diva,Jl. Tampak Siring Blok KJ No. 9-12,PT. Maritim Nusantara Persada,LISA,Jakarta Barat,,,Restoran,10/50/B
Diva,"Central Park Shop Units TL. 1, Jl. Letjen. S. ParmN",PT. Gita Makmur Lestari,Tjhin Dianawi,Jakarta Barat,,,Restoran,10/50/B
Domino's Pizza,Jl. Letjen. S.Parman Kav.28,PT. Dom Pizza Indonesia,Jusroni,Jakarta Barat,021 56985596,021 56985597,Restoran,12/34/B
Domino's Pizza,"Carrefour Puri Indah, Jl. Puri Agung Puri Indah",PT. Dom Pizza Indonesia,Ir. Jusroni,Jakarta Barat,021 5746501,021 5746189,Restoran,10/40/B
Domino's Pizza,"Central Park, Jl. Letjen.S.Parman Kav. 28",PT. Dom Pizza Indonesia,Jusroni,Jakarta Barat,021 56985596,021 56985597,Restoran,12/34/B
Domino's Pizza,"Mal Ciputra, Jl. Letjen.S.Parman Lt. LG Unit 01&05",PT. Dom Pizza Indonesia,Jusroni,Jakarta Barat,021 5601049,021 56954854,Restoran,8/30/B
Domino's Pizza,"Komp. Ruko Citra Niaga Blok B No. 6, Jl. Utan Jati, Pegadungan",PT. Dom Pizza Indonesia,Jusroni,Jakarta Barat,021 5721368,021 5721369,Restoran,10/41/B
Domino's Pizza,"Komp. DPR RI, Jl. Kemanggisan Raya Blok B-3 C",PT. Dom Pizza Indonesia,Jusroni,Jakarta Barat,021 5721368,021 5721369,Restoran,11/43/B
Domino's Pizza,"Hayam Wuruk Plaza, Jl. Hayam Wuruk No. 108",PT. Dom Pizza Indonesia,Jusroni,Jakarta Barat,021 6248288,021 6240608,Restoran,9/36/B
Domino's Pizza,Komp. Mutiara Taman Palem City View Blok A5,PT. Dom Pizza Indonesia,Ir. Jusroni,Jakarta Barat,021 5721368,021 5721369,Restoran,10/35/B
East West,Jl. Letjen. S.Parman Kav. 72,PT. Citi Champion,Yossita Kurniawan,Jakarta Barat,,,Restoran,20/80/A
Eaton,Jl. Raya Perjuangan Blok D-9,PT. Boga Indo Gemilang,Halim Susanto,Jakarta Barat,,,Restoran,20/40/B
Eaton Café,"Mal Taman Anggrek, Jl. Letjen S. Parman Kav. 2",PT. Boga Indo Gemilang,Hartanto Rusli,Jakarta Barat,,,Restoran,10/40/B
Eaton Café,"Komp. Prisma Kedoya Plaza Blok D No. 9, Jl. Raya Kebon Jeruk",PT. Boga Indo Gemilang,Hartanto Rusli,Jakarta Barat,021 53651515,,Restoran,10/40/B
Excelso,"Mall St. Moritz, Jl. Komplek Perum Puri Indah",PT. Prima Rasa Sejahtera,Freddry Chandra Tjong,Jakarta Barat,,,Restoran,26/50/B
Exito,Jl. Mangga Besar Raya No. 44 RT002/RW002,PT. Sumbermitra Asri Hotel,Rulli Maulana Muchidin,Jakarta Barat,021 6252534,021 6252534,Restoran,30/100/A
Fab Café,Jl. Letjen. S.Parman Kav. 28,PT. Santika Mitra Samaya,Bill Toar,Jakarta Barat,021 2700027,021 2700028,Restoran,10/40/B
Fame,"Central Park, Jl. Letjen. S.Parman Kav. 28",,Etty,Jakarta Barat,021 56988888,021 56985100,Restoran,17/75/B
Fiesta Steak,"Mal Taman Anggrek, Jl. Letjend S. Parman",CV. Fajar Indah Semesta,Christopher Aditya,Jakarta Barat,021 56985564,021 56985564,Restoran,5/20/C
Fiesta Steak,"Central Park, Jl. Letjend S. Parman",PT. Cipta Adidaya Semesta,Christopher Aditya,Jakarta Barat,021 56985564,021 56985564,Restoran,5/20/C
Fiesta Steak,"Mal Puri Indah, Jl. Puri Agung",CV. Fajar Indah Semesta,Indrasto Setiadi,Jakarta Barat,021 5822381,,Restoran,4/16/C
Fish & Co,"Mal Taman Anggrek, Jl. Letjend. S. Parman",Henky Rusli,Henky Rusli,Jakarta Barat,021 56998575,021 56998575,Restoran,40/110/A
Fish & Co,"Central Park Mall Lt LG U L-211&L-257B, Jl. Letjen S. Parman Kav. 28, Slipi",PT. Gemilang Food,Henky Rusli,Jakarta Barat,021 29310491,021 29310491,Restoran,22/46/B
Food Gallery,Jl. Perjuangan Raya Kedoya Permai,PT. Panen Lestari Internusa,Ferry Lawrentius  Hollen,Jakarta Barat,021 5310056,021 53676162,Restoran,96/192/A
Food Library,Mal Ciputra Jl. Tanjung Duren Utara I,PT. Ciputra Sentra,Sugwantono Tanto,Jakarta Barat,,,Restoran,91/361/A
Fortuna Ii,Jl. Pintu Besar Selatan No. 69,Lie Kie Tong,Lie Kie Tong,Jakarta Barat,021 6313411,021 6313411,Restoran,6/24/B
Furama,Jl. Hayam Wuruk  No. 45,PT. Wahyu Bintang Sentosa,Kho Pik Hiang,Jakarta Barat,021 6257272,021 6257272,Restoran,15/150/A
Gado Gado Cemara,Jl. Gajah Mada No. 37,PT.Cemara Resto,Tommy Djohan,Jakarta Barat,,,Restoran,10/50/B
Gado Gado Cemara,Jl. Raya Pos Pengumben No. 118A,PT. Cemara Resto,Tommy Djohan,Jakarta Barat,,,Restoran,10/50/B
Gandy Steak,Jl. Hayam Wuruk No. 73,PT. Nafiri Sion,Hendi Soetaniman,Jakarta Barat,021 6391109,021 6256576,Restoran,10/50/B
Gandy Steak,"Perum. Green Garden Blok I 9/3-4, Jl. Panjang",PT. Naviri Simon,Hendy Soetaniman,Jakarta Barat,021 6891109,,Restoran,20/40/B
Gandy Steak House & Bakery,Ruko Green Garden Blok I/9 No. 25,PT. Nafiri Sion,Hendi Soetaniman,Jakarta Barat,021 5801332,,Restoran,25/100/A
Ginsco,Jl. Puri Indah Blok 02 No.1-3,PT. Citra Nusa Insan Cemerlang,Stephanus Abrian Natan,Jakarta Barat,021 58303615,021 58303618,Restoran,10/50/B
Gokana,"Mal Puri Indah, Jl. Puri Agung Raya Lt. II",PT. Champ Resto Indonesia,"Drs.Yunus Ciptawilangga, MBA",Jakarta Barat,021 5822378,021 5822378,Restoran,10/40/B
Gokana,"Mal Ciputra, Jl. Arteri S.Parman",PT. Champ Resto Indonesia,Hanjaya Limanto,Jakarta Barat,021 5662121,021 5662255,Restoran,10/40/B
Gokana,"Plaza Slipi Jaya, Jl. Letjen.S.Parman Lt.1 Kav. 17",PT. Champ Resto Indonesia,Ali Gunawan Budiman,Jakarta Barat,,,Restoran,30/80/A
Gokana Teppan & Ramen,"Taman Anggrek Mal, Jl. Letjen. S. Parman",PT. Champ Resto Indonesia,"Drs. Yunus Ciptawilangga, MBA",Jakarta Barat,,,Restoran,20/60/A
Golden Crown,"Plaza Glodok, Jl. Pinangsia Raya No. 1",PT. Mahkota Aman Sentosa,Rudy Gunawan,Jakarta Barat,021 62302888,021 62302878,Restoran,15/60/A
Golden Star,Jl. Taman Ratu Kemuning Blok. F1/01 A-B-C-D,PT. Baramega Boga Lestari,SIMON TEH,Jakarta Barat,021 65868428,021 65868427,Restoran,40/200/A
Grand Hwa Yen,Jl. Roa Malaka Utara No. 30,PT. Deli Boga Prima,Wahid Sofian,Jakarta Barat,,,Restoran,27/270/A
Grand Monggo Mas,Jl. Daan Mogot No. 49 RT005/RW003,,Ivan Doly,Jakarta Barat,,,Restoran,10/40/B
Grand Ollimo,Jl. Hayam Wuruk No. 102,PT.Hajasa Bersaudara,Harryanto BK,Jakarta Barat,021 6260606,021 6260606,Restoran,15/120/A
Grand Paragon,Jl. Gajah Mada No. 126,PT. Gajah Mada Square,Theressia,Jakarta Barat,021 6258822,021 6252111,Restoran,10/50/B
Grandma Suki,Jl. Puri Indah Raya Blok U1 Lt. 1-3,PT. Grandma Food International,Zuhari Lowis,Jakarta Barat,,,Restoran,10/40/B
Grandma Suki,"Puri X'tertainment, Jl. Puri Indah Raya Blok U1 Lt.",PT. Grandma Food International,Zuhari Lowis,Jakarta Barat,,,Restoran,10/40/B
Hachi Hachi Bistro,Jl. Letjen. S. Parman Kav. 21,CV.Delapan Delapan Sejahtera,Alfred Charano,Jakarta Barat,021 56999527,021 56999527,Restoran,14/50/B
Hachi Hachi Bistro,"Central Park, Jl. Letjen. S. Parman Kav. 28",CV. Delapan Delapan Sejahtera,Alfred Charano,Jakarta Barat,021 56985592,021 56985592,Restoran,12/50/B
Hakata Ikkousha,"Mal Taman Anggrek, Jl. Letjen. S. Parman Kav. 2",PT. Swastika Sukses Perkasa,David Halim,Jakarta Barat,021 5643777,021 5642777,Restoran,10/50/B
Han Gang,"Mal Taman Anggrek, Jl. Letjen. S. Parman Kav. 2",PT. Prioritas Prima Ideal,Arifin Leo,Jakarta Barat,021 5639499,021 5639499,Restoran,35/42/B
Hanamasa,"Mal Puri Indah, Jl. Puri Agung Raya",PT. Adi Boga Cipta,"H. Rachmatullah, SE",Jakarta Barat,021 5822464,021 5822464,Restoran,18/72/A
Hanamasa,Jl. Puri Agung Raya,PT. Adi Boga Cipta,"Rachmatullah, SE",Jakarta Barat,021 5822464,,Restoran,18/72/A
Hanamasa,"Mal Taman Anggrek, Jl. Letjen. S.Parman",PT. Adi Boga Cipta,H.Rachmatullah,Jakarta Barat,021 84598792,021 84598792,Restoran,15/50/B
Handels,Jl. Kopi No. 18A RT005/RW001,PT. Vector Tri Cokro,Bambang Sulistio,Jakarta Barat,,,Restoran,25/90/A
Handel's,Jl. Kopi No. 18A RT005/RW001,PT. Vector Tri Cokro,Bambang Sulistio,Jakarta Barat,021 6900808,021 6900707,Restoran,25/90/A
Happy Puppy,"Komp. Mutiara Taman Palem, Jl. Lingkar Luar Barat Blok A ",CV.Harmoni Kreasi,Hadisaputra Sugianto,Jakarta Barat,021 54356258,021 54356257,Restoran,10/40/B
Happy Puppy,Jl. Raya Panjang Blok. Z2/41-42,PT. Cipta Happy Sempurna,Iwan Sunaryo,Jakarta Barat,021 5816606,021 5816605,Restoran,20/80/A
Hay Thien,Jl. Mangga Besar I No. 34,Lanny Tjokro,Lanny Tjokro,Jakarta Barat,021 58353347,021 58353347,Restoran,10/40/B
Hay Thien,Jl. Puri Indah Raya Blok A No. 1,Basuki Samsudin,Basuki Samsudin,Jakarta Barat,021 58353347,021 58353347,Restoran,10/37/B
Haze,"THR. Lokasari Blok A/33-39, Jl. Mangga Besar",PT. Hanggar Mitra,Djohari Zainurdin,Jakarta Barat,,,Restoran,10/40/B
Haze,"Komp. Lokasari, Jl. Mangga Besar A/33-39",PT. Hanggar Mitra,Djohari Zainurdin,Jakarta Barat,,,Restoran,10/40/B
Healthy Choice,"Komp. Graha Mas, Jl. Raya Pejuangan Blok A",PT. Indospirit Natura,Stephanus Kurniadi S,Jakarta Barat,021 5305665,021 5303950,Restoran,10/28/B
Henis,Jl. Raya Mangga Besar No. 2-F,Pudjiyanto Laimena,Pudjiyanto Laimena,Jakarta Barat,021 6296501,021 6296501,Restoran,10/40/B
Hipsies Kitchen And Bar,"Central Park, Jl. Letjen S. Parman",PT. Boga Karya Sakti,Adrianus Eka Putra,Jakarta Barat,021 83838201,021 56985336,Restoran,10/50/B
Hm. Karaoke,"Gd. Season City Lt. 3, Jl. Latumenten No. 33",PT. Arena Sarana Gembira,Sudjadi Budiono,Jakarta Barat,021 6827218,021 6827218,Restoran,30/120/A
