nama_usaha,alamat_usaha,badan_usaha,penanggung_jawab,wilayah,no_telepon,no_fax,jenis_usaha,kapasitas
Fish & Co,"Cilandak Town Square, Jl. TB. Simatupang Kav. 1",PT. Gading Food,Henky Rusli,Jakarta Selatan,021 75920345,021 75920345,Restoran,8/64/A
Fish & Co,"Pacific Place Mal, Jl. Jend. Sudirman Kav. 52-53",PT. Graha Food Indonesia,Hengky Rusli,Jakarta Selatan,,021 201-108,Restoran,25/100/A
Fj Bistro & Deli,Jl. Kemang Raya No. 25,Bambang Sugiharto Surja,Bambang Sugiharto Surja,Jakarta Selatan,021 7187736,,Restoran,12/50/B
Fj Grill,"Empire Tower, Kemang Village, Jl. Kemang VI",PT. Kasih Agafe Jaya,Bambang Sugiharto Surja,Jakarta Selatan,021 7182715,021 7182716,Restoran,11/44/B
Fj On 7,"Gd. Colony 6 Kemang, Jl. Kemang Raya No. 6A",PT. Kasih Agafe Jaya,Bambang Sugiharto Surya,Jakarta Selatan,021 29056716,,Restoran,12/48/B
Fj Rottisserrie,Jl. Darmawangsa VI & IX,,Bambang Sugiharto Surja,Jakarta Selatan,021 72786550,,Restoran,10/50/B
Flour Flour,"Lotte Shopping Avenue Ciputra World, Jl. Prof. Dr. Satrio Kav. 3-5, Karet Kuningan, Setiabudi",PT. Kemistry Indonesia,Jessica Lesmana,Jakarta Selatan,,,Restoran,10/50/B
Fly Ginseng Chicken,"Gd. Bidakara, Jl. Jend. Gatot Subroto Kav. 71-73",CV. Heesu Sejahtera,Hendra,Jakarta Selatan,,,Restoran,15/45/B
Foodism,Jl. Taman Kemang II No. 14A RT014/RW001 ,PT. Foodism Arta,Ratna Marina I.V. Joesoef,Jakarta Selatan,021 75908536,021 75908538,Restoran,20/80/A
Fook Yew,"Gandaria City, Jl. Sultan Iskandar Muda",PT. Sinaran Sejahtera,Christian Rijanto,Jakarta Selatan,,,Restoran,15/50/B
Fortune,"Plaza 3 Pondok Indah Blok F No. 1-4, Jl. TB. Simatupang ",PT. Fortune Pondok Indah,Yogi Idham Fauzi,Jakarta Selatan,,,Restoran,10/40/B
Fourties,Jl. Kemang Raya No. 67 RT004/RW002,PT.Wahana Tirtamas,Dodi Laksamana,Jakarta Selatan,021 7191333,021 7191333,Restoran,20/80/A
Fuji Soba,"Lotte Shopping Avenue Ciputra World 1 Jakarta, Jl. Prof. Dr. Satrio Kav. 3-5, Karet Kuningan, Setiabudi",PT. Daitan Indonesia,Jessica Lesmana,Jakarta Selatan,021 3901138,021 3914067,Restoran,15/70/A
Fukuro,"Kawasan Niaga Terpadu Sudirman Lot. 14, Jl. Jend Sudirman Kav. 52-53",PT. Hanabusa Asia Pasifik,Ryo Okawa,Jakarta Selatan,,,Restoran,15/50/B
Gado Gado Boplo,Jl. Prof. Dr. Satrio No. 289,,Juliana Hartono,Jakarta Selatan,021 5134081,021 5134081,Restoran,10/40/B
Gado Gado Boplo,Jl. RS. Fatmawati No. 19 RT014/RW003,,Juliana Hartono,Jakarta Selatan,021 7660653,021 7660653,Restoran,10/40/B
Gado Gado Boplo,"Jl. RC. Veteran, Bintaro Raya RT004/RW012",,Juliana Hartono,Jakarta Selatan,,,Restoran,10/40/B
Gado Gado Cemara,Jl.Prof. DR. Satrio No. 64 RT001/RW001,PT.Cemara Resto,Tommy Djohan,Jakarta Selatan,,,Restoran,10/40/B
Gahyo,"SCBD, Jl. Jend. Sudirman Kav. 52 - 53",PT. Ga Hyo Sukses,Arif Purbo Warsono,Jakarta Selatan,021 52897044,021 52897541,Restoran,23/112/A
Galaxi Chandra Purnama,"Komp. Golden Fatmawati Blok H/4, Jl. RS. Fatmawati",PT. Galaxi Chandra Purnama,Simon Prasetio Liauw,Jakarta Selatan,021 75914687,021 75914687,Restoran,10/40/B
Gandaria Xxi Café,"Gandaria City, Jl. Sultan Iskandar Muda",PT. Nusantara Sejahtera,Tri Rudy Anitio,Jakarta Selatan,021 31901188,021 31901144,Restoran,12/48/B
Ganesha,Jl. Kemang Raya No. 3A-5 RT014/RW001,PT. Ganesha Sanskritik Indonesia,Jai Prakash Dave,Jakarta Selatan,021 5719415,021 5719415,Restoran,14/50/B
Gangnam,"Komp. Wijaya Graha Puri Blok F No. 20, Jl. Wijaya II, Kebayoran Baru",PT. YSJ Maju Global,Vransiy Munita,Jakarta Selatan,,,Restoran,20/100/A
Garuda,Jl. Sultan Iskandar Muda No. 79D,"H. Zulhelfi, SE","H. Zulhelfi, SE",Jakarta Selatan,,,Restoran,15/60/A
Gaya Sung,"Wijaya Graha Puri, Jl. Wijaya II Blok F. 45-57",PT. Kerin Jaya Makmur,R. Dede Waskita,Jakarta Selatan,021 7257373,021 7257373,Restoran,10/60/A
Gayo Coffee,"Mall Pondok Indah II Kav. IV/TA, Jl. Metro Pondok Indah",PT. Seruput Gayo Pondok Indah,Erlina Sira Putri,Jakarta Selatan,,,Restoran,10/40/B
Gayo Coffee,"Cilandak Town Square, Jl. TB. Simatupang Kav. 1",PT. Cipta Gayo Sepuluh,Hendry Nofizal,Jakarta Selatan,021 72801010,,Restoran,10/401/B
Gedung Putih,"Bapindo Plaza, Jl. Jend.Sudirman Kav. 54-55",PT. Putra Inko Perkasa,Lee Sang Hyun,Jakarta Selatan,,,Restoran,50/200/A
Geisha Eksekutif,"Mal Blok M, Jl. Melawai VIII/4",CV. Geisha Eksekutif,Ir. Buyung Achmad Yani,Jakarta Selatan,021 7233013,,Restoran,20/40/B
Gelato,"Darmawangsa Square, Jl. Darmawangsa VI & IX",PT. Selera Sukses Mandiri,Muljoyo Salim,Jakarta Selatan,021 72788310,021 72788320,Restoran,12/40/B
Georg Peck Coffee & Tea,"Plaza Semanggi, Jl. Jend. Sudirman Kav. 50",PT. Cheers Indonesia,Tjandra Rini,Jakarta Selatan,021 5355761,021 5355760,Restoran,10/50/B
Gingerepublic,Jl. Mega Kuningan Barat B 3-4,PT. Jala Boga,Teddy Rofiandi,Jakarta Selatan,021 3002999,,Restoran,30/100/A
Gingerepublic,Jl. Mega Kuningan Barat B 3-4,PT. Jala Boga,Teddy Rofiandi,Jakarta Selatan,021 3002999,,Restoran,30/100/A
Giovanese,"Gandaria City Lt.Mainstreet UG M-19, Jl. Sultan Iskandar Muda",PT. Graha Persada Nusa,Boejono Tjokro,Jakarta Selatan,021 29007939,021 29007943,Restoran,16/72/A
Gloria Jean's Coffee,Jl. Jend. Sudirman Kav. 50,PT. Penta Fili Investama,Drs. Merhasin Taslim,Jakarta Selatan,021 25536472,,Restoran,33/117/A
Gloria Jean's Coffee,Jl. Jend. Sudirman Kav. 50,PT. Penta Fili Investama,Drs. Merhasin Taslim,Jakarta Selatan,021 25536472,,Restoran,33/117/A
Gogo Ramen,Jl. Darmawangsa VI & IX,PT. Mitra Sarana Boga,Georgius Alexander,Jakarta Selatan,021 7205066,021 72787250,Restoran,10/40/B
Gogo Ramen,Jl. Darmawangsa VI & IX,PT. Mitra Sarana Boga,Georgius Alexander,Jakarta Selatan,021 7205066,021 72787250,Restoran,10/40/B
Gokana,"Mal Cilandak, Jl. Raya Cilandak KKO",PT. Champ Resto Indonesia,Ali Gunawan Budiman,Jakarta Selatan,,,Restoran,12/48/B
Gokana Teppan,Jl. Bulungan No. 76,PT. Champ Resto Indonesia,Drs. Yunus Ciptawilangga,Jakarta Selatan,,,Restoran,10/50/B
Goku Shabu,Jl. HR. Rasuna Said Kav. 62,PT. Indo Megah,Handi Kurniawan,Jakarta Selatan,021 5257393,021 5256763,Restoran,9/30/B
Gold Rush,"Blok M, Jl. Melawai IX/8 ",PT. Nada Asia Timur,Nizmah,Jakarta Selatan,021 7268259,021 7206406,Restoran,20/80/A
Golden Century,Jl. HR. Rasuna Said Kav. 62,,Ramdani,Jakarta Selatan,,,Restoran,10/40/B
Golfmax,Jl. Mega Kuningan Barat,PT. Golfmax Indonesia,Jeffry Djajasaputra,Jakarta Selatan,,,Restoran,10/50/B
Gourmand Bistro,Mall Pondok Indah I Street Galery GF No. G08,PT. Citarasa Jaya Lestari,Grace Dewi Brasali,Jakarta Selatan,,,Restoran,20/84/A
Graffiti,"Hotel Mercure, Jl. RA. Kartini No. 18 RT007/RW007",PT. Karya Propertindo Investama,Abby Ernest,Jakarta Selatan,021 7595262,021 75913667,Restoran,20/112/A
Grand Lotus,"Mal Kota Kasablanka, Jl. Casablanca Kav. 9-10",,Lam Olivia Dharma,Jakarta Selatan,,,Restoran,20/60/A
Gudeg Jogya,Jl. Tebet Barat Dalam VII/27,,Ny. Sulami,Jakarta Selatan,021 8292519,,Restoran,12/48/B
Gula Merah,Jl. HR. Rasuna Said Kav. 62,PT. Tripanca Jaya Lestari,Teddy Harsono,Jakarta Selatan,,,Restoran,10/40/B
Gusto Tapas And Wine Bar,"Rasuna Epicentrum, Jl.HR.Rasuna Said Epicentrum",PT. Allegra Boga Perdana Makmur,Mahardika Permana,Jakarta Selatan,021 29941199,021 29941198,Restoran,20/80/A
Gyoza,"Jl. Mega Kuningan Lot. 8.6-8,7/E.3.3 Unit C7",PT. Gyoza Boga Indonesia,Suprajitno Pegeng,Jakarta Selatan,021 5764364,021 5764364,Restoran,10/40/B
Gyu Kaku,"Pacific Place Mal, Jl. Jend.Sudirman Kav. 52-53",PT. Global Nusa Jaya Abadi,Ramon Benyamin Liando,Jakarta Selatan,,,Restoran,20/50/B
Haagen-Dazs Ice Cream,Jl. Sultan Iskandarmuda,PT. Rahayu Arumdhani,Widhi Darmawan,Jakarta Selatan,,,Restoran,10/50/B
Haagen-Dazs Ice Cream,Jl. Sultan Iskandarmuda,PT. Rahayu Arumdhani,Widhi Darmawan,Jakarta Selatan,,,Restoran,10/50/B
Hacienda Mexican Bar & Grill,"Mal Pondok Indah, Jl. Metro Pondok Indah",PT. Bahana Pondok Indah Makmur,Hari Setiawan,Jakarta Selatan,,,Restoran,14/60/A
Hakata Ikkousha,"Gd. Kemang Arcade Lt.1, Jl. Kemang Raya No. 2",PT. Rumah Bahagia Pertama,Sumitro,Jakarta Selatan,,,Restoran,15/50/B
Han Gang,"Street Gallery Pondok Indah Mall, Jl. Metro Pondok Indah",PT. Prioritas Prima Ideal,Arifin Leo,Jakarta Selatan,,,Restoran,24/98/A
Han Gang 99,Jl. Woltermonginsidi No. 99,PT. Prioritas Prima Ideal,Arifin Leo,Jakarta Selatan,021 72787802,021 2700105,Restoran,25/145/A
Han Min Jok,Jl. Wolter Monginsidi No. 88Q,PT. Prima Jaya Mandiri Sejahtera,Eli Haryani,Jakarta Selatan,021 7252688,021 7252688,Restoran,10/40/B
Hanamasa,Jl. Metro Pondok Indah,PT. Adi Boga Cipta,Rachmatullah,Jakarta Selatan,021 75915251,,Restoran,20/100/A
Hanamasa,"Mal Pondok Indah Blok III - B, Jl. Metro Pondok Indah",PT. Adi Boga Cipta,"H. Rachmatullah, SE.",Jakarta Selatan,021 75915251,021 8294341,Restoran,20/100/A
Hanamasa,"Pejaten Village, Jl. Warung Jati Barat, Warung Buncit",PT. Adi Boga Cipta,"H. Rachmatullah, SE",Jakarta Selatan,,,Restoran,12/50/B
Hanamasa,"Plaza Semanggi, Jl. Jend. Sudirman Kav. 50",PT. Adi Boga Citra,"H.Rachmatullah, SE",Jakarta Selatan,,,Restoran,12/50/B
Hanamasa,"Poins Square Shopping Mall, Jl. R.A. Kartini No. 1",PT. Adi Boga Cipta,H. Rachmatullah,Jakarta Selatan,,,Restoran,12/50/B
Hanamasa,"Mal Ambassador Lt. 1 No. 36, Jl. Prof. Dr. Satrio No. 14",PT. Adi Boga Cipta,"H. Rachmatullah, SE",Jakarta Selatan,,,Restoran,12/50/B
Hanamasa Yakiniku,Jl. Mahakam I No. 160,PT. Adiboga Cipta,Rachmatullah,Jakarta Selatan,021 7202366,,Restoran,15/60/A
Hanei,"Mal Pondok Indah 2 Lt. 3 # 326, Jl. Metro Pondok Indah",PT. Kencana Langgeng Rasa,Ben Aristarchus Widyatmodjo,Jakarta Selatan,021 75920744,021 75920744,Restoran,13/53/A
Hanei Ramen & Sushi,"Mall Pondok Indah I Lt.2 #201, Jl. Metro Pondok Indah",PT. Kencana Langgeng Rasa,Ben Aristarchus W,Jakarta Selatan,,,Restoran,12/58/A
Hang Gang,"Pacific Place Mal, Jl. Jend.Sudirman Kav. 52-53",PT. Prioritas Prime Ideal,Arifin Leo,Jakarta Selatan,,,Restoran,10/40/B
Hangoga,Jl. HR. Rasuna Said,PT. Hangoga Indonesia,Akhmad Dwiyoga Meidianto,Jakarta Selatan,,,Restoran,50/200/A
Hangoga,Jl. Prof. Dr. Satrio Kav. 18,PT. Hangoga Indonesia,Akhmad Dwiyoga Meidianto,Jakarta Selatan,,,Restoran,35/140/A
Hansol,Jl. Widya Chandra VIII No. 33,PT. Hansol Mulia,Nur Inayah,Jakarta Selatan,,,Restoran,13/52/A
Happy Puppy,"Gd. La Codefin, Jl. Kemang Raya No. 8",PT. Mitra Musika Sejati,Louis Fransiskus Hartanto,Jakarta Selatan,,,Restoran,14/40/B
Happy Puppy,"Komp. Golden Plaza Blok A17 - A1, Jl. Fatmawati ",PT. Mitra Imperium Abadi,Melinna Aprilia,Jakarta Selatan,021 7507520,021 7507520,Restoran,20/50/B
Hard Rock Café,"Pacific Place Mall Lot. 3-5, Jl. Jend. Sudirman Kav. 52-53",PT. Harum Rahayu Citra,Handi Jatna,Jakarta Selatan,,,Restoran,25/100/A
Healthy Choice,Jl. Mega Kuningan Barat,PT.Indospirit Natura,Stevan Lie,Jakarta Selatan,021 30029770,021 30029768,Restoran,17/34/B
Helen's Bistro,Jl. Wolter Monginsidi No. 63 B,PT. Sumber Cipta Rasa,Helen Sutanto,Jakarta Selatan,021 7258885,021 7265111,Restoran,13/40/B
Hema,"TIS Square, Jl. MT. Haryono Kav. 8-9",CV. Hema,Ratna Savitri Handayani,Jakarta Selatan,021 8295548,021 8293932,Restoran,30/90/A
Hemisphere,Jl. Darmawangsa X,PT. Selaras Mandiri Utama,Japri Susiawan,Jakarta Selatan,021 72795905,,Restoran,10/50/B
Hide And Seek Restaurant,"Fair Ground Lot. 14 SCBD, Jl. Jend. Sudirman Kav. 52-53",PT. Elysium Besar Internasional,Feisal Hamka,Jakarta Selatan,,,Restoran,10/40/B
Hide Yamamoto,"Lotte Shopping Avenue Ciputra World 1, Jl. Prof. Dr. Satrio Kav. 3-5, Karet Kuningan, Setiabudi",PT. Hide Yamamoto Jakarta,Jessica Lesmana,Jakarta Selatan,021 3901138,021 3914067,Restoran,30/130/A
High On Caffeine,"Menara Palma, Jl. HR.Rasuna Said X2 Kav. 6",CV. Alpha Charlie,Adil Darmadi,Jakarta Selatan,,,Restoran,10/50/B
Hoka Hoka Bento,Jl. Kapten Tendean No. 42,PT. Eka Bogainti,Hendra Arifin,Jakarta Selatan,021 5206447,021 5226444,Restoran,70/140/A
Hokben,"Poins Square Shopping Mall, Jl. R.A.Kartini No. 1",PT. Eka Boga Inti,Hendra Arifin,Jakarta Selatan,,,Restoran,20/80/A
Hokben,"Gd. La Codefin, Jl. Kemang Raya No. 8",PT. Eka Bogainti,Hendra Arifin,Jakarta Selatan,021 7196163,021 7196157,Restoran,67/134/A
Hokben,Jl. Ciledug Raya No. 18C,PT. Eka Boga Inti,Hendra Arifin,Jakarta Selatan,,,Restoran,15/50/B
Hokben,"Mal Ambassador, Jl. Prof. Dr. Satrio No. 14, Kuningan",PT. Eka Bogainti,Hendra Arifin,Jakarta Selatan,021 5760443,,Restoran,47/154/A
Hokben,"Plaza Blok M, Jl. Bulungan No. 76",PT. Eka Bogainti,Hendra Arifin,Jakarta Selatan,021 7209220,021 7209240,Restoran,41/162/A
Hokben,"Kartika Chandra, Jl. Jend. Gatot Subroto Kav. 18-20",PT. Eka Bogainti,Hendra Arifin,Jakarta Selatan,021 5264993,021 5264994,Restoran,38/138/A
Hokben,"Gd. World Trade Centre, Jl. Jend. Sudirman Kav. 29-31, Karet",PT. Eka Bogainti,Hendra Arifin,Jakarta Selatan,021 5211350,021 5211351,Restoran,36/104/A
Hokben,"Gd. Setiabudi I, Jl. HR. Rasuna Said Kav. 62",PT.Eka Boga Inti,Hendra Arifin,Jakarta Selatan,021 52900833,021 52900834,Restoran,10/40/B
Hokben,"Mal Pondok Indah Lantai I, Jl. Metro Pondok Indah",PT. Eka Bogainti,Hendra Arifin,Jakarta Selatan,021 7506888,021 7506999,Restoran,38/68/A
Hokben,"Gd. Sentra, Jl. MT. Haryono Kav. 1 Lt. 2",PT. Eka Bogainti,Hendra Arifin,Jakarta Selatan,021 8298171,021 8297476,Restoran,54/96/A
Hokben,"Plaza Semanggi, Jl. Jend. Sudirman Kav. 50",PT. Eka Bogainti,Hendra Arifin,Jakarta Selatan,021 25536448,021 25536449,Restoran,49/89/A
Hokben,Jl. Iskandar Muda No. 8B,PT. Eka Bogainti,Hendra Arifin,Jakarta Selatan,,,Restoran,10/50/B
Hokben,"Pasar Festival, Jl. HR. Rasuna Said Kav. C.22",PT. Eka Bogainti,Hendra Arifin,Jakarta Selatan,,,Restoran,29/86/A
Hokben,Jl. Raya Kalibata,PT. Eka Bogainti,Hendra Arifin,Jakarta Selatan,021 7209240,021 7209240,Restoran,10/50/B
Hokben,Jl. Tebet Raya No. 25 Blok A RT001/RW002,PT.Eka Boga Inti,Hendra Arifin,Jakarta Selatan,,,Restoran,10/40/B
Hokben,Jl. Raya Ragunan No. 12B,PT. Eka Boga Inti,Hendra Arifin,Jakarta Selatan,,,Restoran,15/50/B
Hokben,"Mal Cilandak, Jl. Raya Cilandak KKO",PT. Eka Bogainti,Hendra Arifin,Jakarta Selatan,,,Restoran,25/100/A
Homare,"Mega Building, Jl. Melawai VIII No. 4 Lt. 6",PT. Green Giok,Idawati,Jakarta Selatan,021 7267332,021 7267334,Restoran,15/50/B
Hong Lung Szechuan Cuisine,Jl. HR. Rasuna Said,PT. Tataboga Epicentrum,"Dra. Aviliani, Msi",Jakarta Selatan,,,Restoran,23/60/A
Hongkong Café,"Mall Gandaria City, Jl. Sultan Iskandar Muda RT009/RW006 ",PT. Arena Multiboga,Petrus Leonardus S,Jakarta Selatan,,,Restoran,17/70/A
Honoka,Jl. Panglima Polim Raya No. 5B,PT. Ryory Prima Resto,Dian Puji Astuti,Jakarta Selatan,021 7202883,021 7202883,Restoran,10/60/B
Hope Town Kitchen & Tea Room,"Permata Kuningan, Jl. Kuningan Mulia No. 9",PT. Hop Eterna,Tjung Lina,Jakarta Selatan,021 29069555,021 29069777,Restoran,20/80/A
Hotel Sentra Boutique,Jl. Ciledug Raya No. 17 RT008/RW010,CV.Sentra Cipulir,Ir.Zainuri Yunus,Jakarta Selatan,,,Restoran,25/100/A
Hp Gardena,Jl. Panglima Polim Raya No. 43C,,Tjong Jie Sen,Jakarta Selatan,021 7396761,,Restoran,19/100/A
Huize Van Wely,"Pacific Place Mal Lot. 3-5, Jl. Jend. Sudirman Kav. 52-53",PT. Naleda Boga Services,Meity Tjiptobiantoro,Jakarta Selatan,,,Restoran,29/68/B
Huize Van Wely,"Gd. Papilon, Jl. Kemang Raya No. 45 AA",PT. Naleda Boga Services,M. Tjiptobiantoro,Jakarta Selatan,021 7191975,021 7196067,Restoran,12/48/B
Hummingbird,"Kuningan City Mall, Jl. Prof. Dr. Satrio Kav. 18",Yogi Pranata,Yogi Pranata,Jakarta Selatan,021 30065787,021 30056056,Restoran,12/50/B
Hurry Curry Of Tokyo,Jl. Jend. Sudirman Kav. 52-53,PT. Prama Corporindo,Linda Darma,Jakarta Selatan,,,Restoran,10/40/B
Hyde,Jl. Taman Kemang I Blok A No. 8,PT. Odetta Boga Mandiri,Putri Madarina,Jakarta Selatan,,,Restoran,15/75/A
I - Ta Suki,Jl. Sultan Iskandar Muda,PT. Citra Rasa Boga,"Chung, Wendelina Wina",Jakarta Selatan,,,Restoran,12/48/B
I - Tasuki,"Mal Kota Kasablanka, Jl. Casablanca Raya No. 8",PT.Tiga Aksara Sakti,Sari Purnawati,Jakarta Selatan,021 29464985,021 29464985,Restoran,25/100/A
Ichiban Sushi,"Mal Pondok Indah, Jl. Metro Pondok Indah",PT. Brostindo Prima Indonesia,Bernt Hanlee Ramli,Jakarta Selatan,,,Restoran,4/12/C
Ideas,"Pondok Indah Mal Lt. Dasar G009-G010, Jl. Metro Pondok Indah",PT. Sarana Kuliner Sejahtera,Lieng Boen Jeng,Jakarta Selatan,021 7510412,021 7511895,Restoran,10/40/B
Iga Iga,Jl. Sultan Iskandar Muda No. 08,CV. Ratu Iga Perdana,DRA. Mayasari,Jakarta Selatan,021 29053210,021 29053210,Restoran,12/50/B
Iga Iga,"Mal Gandaria City Lt.UG MU-06, Jl. Sultan Iskandar Muda, Kebayoran Lama",CV. Ratu Iga Perdana,DRA. Mayasari,Jakarta Selatan,021 29053210,021 29053210,Restoran,12/50/B
Ikan Bakar Manado,Jl. Adhyaksa 9 No. 1 RT004/RW005,PT. Waroeng Paku Pipit,Sandy Liga,Jakarta Selatan,,,Restoran,25/150/A
Ikkado Ramen,"Mal Kota Kasablanka, Jl. Casablanca Kav. 88",PT. Mie Makmur Kasablanka,Irene Tjahyadi,Jakarta Selatan,,,Restoran,10/50/B
Ikkudo Ichi,"Pacific Place Mall Lvl Unit 5-58 SCBD Lot 3-5, Jl. Jend. Sudirman Kav. 52-53",PT. Mie Sukses Pasifik,William Surya,Jakarta Selatan,,,Restoran,15/50/B
Ikuze,"Kemang Village, Gd. Lippo Mal Kemang, Jl. Pangeran Antasari No. 36, Kemang",PT. Gaia Boga Utama,Angie Claudia Fachry,Jakarta Selatan,021 7222513,021 72790573,Restoran,10/50/B
Ikuze,"Epicentrum Walk, Jl. HR. Rasuna Said",PT. Gaia Boga Utama,Angie Claudia Fachry,Jakarta Selatan,021 29941199,021 29941198,Restoran,20/80/A
Il Primo,"Wisma UIC, Jl. Jend.Gatot Subroto Kav. 6-7",PT.Wiranusa Grahatama,Yani Alifen,Jakarta Selatan,021 57945045,021 57945050,Restoran,15/60/A
Imae Japanese Shabu-Shabu,"Pacific Place Mal, Jl. Jend.Sudirman Kav. 52-53",PT. Imae Cipta Selera,Bernie Prajoga,Jakarta Selatan,021 57973177,,Restoran,20/50/B
Imperial Cakery,Jl. Warung Jati Barat No. 39,PT.Adicipta Boga Intiprima,Abigail Djojonegoro,Jakarta Selatan,021 7822805,021 7822760,Restoran,10/40/B
Imperial Cakery,Jl. HR.Rasuna Said Kav. 62,PT.Adicipta Boga Intiprima,Abigail Djojonegoro,Jakarta Selatan,021 5223893,021 5223894,Restoran,7/28/B
Imperial Cakery & Dim Sum,"Cilandak Town Square, Jl. TB.Simatupang Kav. 1",PT. Adicipta Boga Intiprima,Abigail Djojonegoro,Jakarta Selatan,021 75920334,,Restoran,12/48/B
Imperial Chef,Lotte Shopping Avenue Lt. 3 Ruang 3F-12& A06,PT. Selera Kian Makmur,Lin Manuhutu,Jakarta Selatan,021 72781223,021 72781227,Restoran,54/215/A
Imperial Kitchen & Dimsum,"Mal Cilandak, Jl. Raya Cilandak KKO",PT. Adicipta Boga Intiprima,Abigail Djojonegoro,Jakarta Selatan,,,Restoran,15/50/B
Imperial Kitchen & Dimsum,Jl. Warung Jati Barat No. 39,PT. Adicipta Boga Intiprima,Abigail Djojonegoro,Jakarta Selatan,021 7822611,021 7824822,Restoran,5/18/C
Imperial Kitchen & Dimsum,Jl. Warung Jati Barat No. 39,PT. Adicipta Boga Intiprima,Abigail Djojonegoro,Jakarta Selatan,021 7822611,021 7824822,Restoran,5/18/C
Imperial Kitchen & Dimsum,"Kuningan City, Jl. Prof. Dr. Satrio Kav. 18",PT. Adicipta Boga Intiprima,Abigail Djojonegoro,Jakarta Selatan,,,Restoran,15/50/B
Incanto,"Gd. The Peak, Jl. Setiabudi Raya No. 9",PT. Frasers Hospitality Investment,Stephen Koay Swee Lim,Jakarta Selatan,,,Restoran,19/88/A
Inns,Jl. Cilandak KKO No. 2,,Budi Heryanto,Jakarta Selatan,021 7828456,021 7501125,Restoran,22/88/A
Inns,Jl. Cilandak KKO No. 2,,Budi Heryanto,Jakarta Selatan,021 7828456,021 7501125,Restoran,22/88/A
Inul Vista,Jl. Tebet Raya No. 50 RT004/RW004,PT. Duta Nada Mas Prima,Rendy Tanudjaja,Jakarta Selatan,021 54212424,021 54211414,Restoran,10/40/B
Inul Vista Family Ktv,"Komp. Golden Fatmawati, Jl. RS. Fatmawati No. 15, Cilandak",CV. Nada Elok Mulia,Paulina Wahyuasih Indra W,Jakarta Selatan,,,Restoran,10/40/B
Inul Vizta,"Point Square, Jl. R.A.Kartini No. 1, Lingkar Luar Selatan",PT. Berlian Nada Utama,Paulina Wahyuasih Indra Wati,Jakarta Selatan,021 7695252,021 7690955,Restoran,20/80/A
Inul Vizta,Jl. Melawai Raya No. 189 Lantai 2,PT. Nada Prima Sentosa,Herman Kamal,Jakarta Selatan,021 7231917,021 7231964,Restoran,20/80/A
Inul Vizta Family Ktv,"Pejaten Village, Jl. Warung Jati Barat No. 39",CV. Sahabat Lestari,Risma Situmorang,Jakarta Selatan,021 45857246,021 45857521,Restoran,10/40/B
Ippudo,"Pacific Place Mall Lvl/Unit 5-37 SCBD Lot. 3-5, Jl. Jend. Sudirman Kav. 52-53",PT. Ippudo Catering Indonesia,Ir. S. Ardianto Hadiwidjaja,Jakarta Selatan,021 57973339,021 57973196,Restoran,15/66/A
Iseya,"Sampoerna Strategic Square, Jl. Jend. Sudirman Kav. 45-46, Setiabudi",PT. Anggarda Himber Indonesia,Andrew Himawan,Jakarta Selatan,021 57700014,021 5770901,Restoran,15/50/B
Iseya,"Sampoerna Strategic Square Jl. Jend. Sudirman Kav. 45-46, Setiabudi",PT. Anggarda Himber Indonesia,Andrew Himawan,Jakarta Selatan,021 57700014,021 5770901,Restoran,15/50/B
Ivy Bistro,"Dharmawangsa Square 34, Jl. Dharmawangsa Raya VI, Kebayoran Baru",PT. Klabo Investama,Dr. Sri Adriyani Lestari,Jakarta Selatan,021 7265766,021 7265616,Restoran,10/24/B
Izzi Pizza,Jl. MT. Haryono No. 1 RT002/RW006,PT. Sriagung Cahya Sakti,Sarwan,Jakarta Selatan,021 83700733,021 83700736,Restoran,30/100/A
Izzi Pizza,Jl. TB.Simatupang Kav. 17,PT. Sriagung Cahaya Sakti,Sarwan,Jakarta Selatan,021 75920220,021 75920221,Restoran,25/100/A
Izzi Pizza,Jl. TB.Simatupang Kav. 17,PT. Sriagung Cahaya Sakti,Sarwan,Jakarta Selatan,021 75920220,021 75920221,Restoran,25/100/A
Izzi Pizza,Jl. Jend.Sudirman Kav. 29,PT.SRIAGUNG CAHYA SAKTI,Sarwan,Jakarta Selatan,021 3147220,,Restoran,10/40/B
J - Wine,"Puri Casablanca Basement, Jl. Casablanca No. 1",PT. Mitra Putera Indonesia,Adji Aftab Rajramdhani,Jakarta Selatan,021 5330475,021 5330477,Restoran,10/40/B
J' Chef,"City Plaza LG-09, Jl. Jend. Gatot Subroto No. 42",,Johnny Cahyadi,Jakarta Selatan,021 52960602,021 52960602,Restoran,15/50/B
Jala-Jala,Jl. Prof. Dr. Satrio Kav. 18 RT007/RW004 Lt.3 Unit-09,CV. Inti Sari Laut,Suman Yamin,Jakarta Selatan,,,Restoran,10/50/B
Jala-Jala,Jl. Prof. Dr. Satrio Kav. 18 RT007/RW004 Lt.3 Unit-09,CV. Inti Sari Laut,Suman Yamin,Jakarta Selatan,,,Restoran,10/50/B
Jang Su De,Jl. Woltermonginsidi No. 83,PT. Hosell Jaya,Kandar Baswara,Jakarta Selatan,021 7264570,021 7264571,Restoran,40/85/A
Jang Su De,Jl. Woltermonginsidi No. 83,PT. Hosell Jaya,Kandar Baswara,Jakarta Selatan,021 7264570,021 7264571,Restoran,40/85/A
Jbs Café & Resto,"Jl. Kebayoran Baru No. 73 B-C, Velbak",PT. Jakarta Boxing Stadium,Indria Octavia Muaja,Jakarta Selatan,,,Restoran,10/50/B
Jc's Café,Jl. Jend. Sudirman Kav. 52-53,PT.Jasa Cipta Swadaya,Jessy Ria Sekeon,Jakarta Selatan,021 5150737,,Restoran,10/24/C
Jc's Café,Jl. Jend. Sudirman Kav. 52-53,PT.Jasa Cipta Swadaya,Jessy Ria Sekeon,Jakarta Selatan,021 5150737,,Restoran,10/24/C
Jimm's Sports Café,"Bellagio Boutique Mal, Jl. Mega Kuningan Barat",PT. Anugrah Sukses Pratama,William Gomez,Jakarta Selatan,021 30066771,021 30066771,Restoran,7/20/C
Jitlada Thai Cuisine,"Lotte Shopping Avenue, Jl. Prof. Dr. Satrio Kav. 3",-,Louis Larry,Jakarta Selatan,021 29889321,021 29889321,Restoran,22/96/A
Jittlada Thai Cuisine,"Mal Pondok Indah 2, Jl. Metro Pondok Indah",Louis Larry,Louis Larry,Jakarta Selatan,021 75920867,,Restoran,13/66/A
Jittlada Thai Cuisine,Jl. Metro Pondok Indah,,Louis Larry,Jakarta Selatan,,,Restoran,13/66/A
Jj Royal Brasserie,Ciputra World Lotte Shopping Avenue LG-01-02,PT. Legenda Kuliner,Muhammad Rendhy Aditya,Jakarta Selatan,021 98564335,021 98564335,Restoran,20/80/A
Joe Smoker Bbq,Jl. Lingkar Mega Kuningan Kav. E.5.2 No. 1,PT. Mantako International Taste,Sammy Bolung,Jakarta Selatan,,,Restoran,20/80/A
Johnny Rockets,"Lotte Shopping Avenue, Jl. Prof. Dr. Satrio Kav. 3",PT. Riyanti Investama International,SB. Wiryanti Sukamdani,Jakarta Selatan,021 29022959,021 29022958,Restoran,18/81/A
Johnny Rockets,"Street Gallery PIM, Jl. Metro Pondok Indah Blok II",PT. Riyanti Investama International,S.B Wiryanti Sukamdani,Jakarta Selatan,021 29022959,021 29022958,Restoran,22/69/A
Julian Nyland,Jl. Kemang Selatan Raya No. 150,Yusuf SB,Yusuf SB,Jakarta Selatan,021 7883762,,Restoran,25/100/A
Jun Njan,Jl. Sultan Iskandar Muda No. 35D,PT. Laris Sentosa Makmur,Lisdiana Setiarman,Jakarta Selatan,021 7252605,021 7252605,Restoran,9/36/B
Jun Njan,"Gandaria City, Jl. Sultan Iskandar Muda",PT. Jun Njan Express,Bong Kristin,Jakarta Selatan,,,Restoran,20/80/A
Jun Njan,"Pondok Indah Mall I Foodcourt Area 51, Jl. Metro Pondok Indah",PT. Laris Sentosa Makmur,Hendy Zanas,Jakarta Selatan,021 7252604,021 7252604,Restoran,12/48/B
Jun Njan,Jl. H.R. Rasuna Said,PT. Saputra Perkasa Abadi,Tjoe Wendy Saputra,Jakarta Selatan,,,Restoran,10/100/A
J-Wine,"Mal Pondok Indah 2, Jl. Metro Pondok Indah IV-T",PT. Mitra Putera Indonesia,Adji Aftab Rajramdhani,Jakarta Selatan,021 57993455,021 57993477,Restoran,10/40/B
K O I,Jl. Mahakam I No. 2,PT. Aneka Serba Boga,Amalia Pramesti,Jakarta Selatan,021 7222864,021 7236428,Restoran,20/100/A
K O I,Jl. Kemang Raya No. 72,PT. Aneka Serba Boga,Amalia Pramesti,Jakarta Selatan,,,Restoran,20/100/A
Kafe Anda,Jl. Jend. Gatot Subroto,,Dewi Mersitarini,Jakarta Selatan,,,Restoran,18/50/B
Kafe Batik,Jl. Iskandarsyah II No. 2,PT. Pasaraya Tosersajaya,Ahmad Dipoditiro,Jakarta Selatan,021 7260170,021 7260695,Restoran,10/40/B
Kafe Betawi,Jl. Prof. Dr. Satrio Kavling 18,PT. Citra Rasa Betawi,Johannes Paeddy W,Jakarta Selatan,,,Restoran,12/50/B
Kafe Betawi,"Mal Pondok Indah 2, Jl. Metro Pondok Indah",PT. Citra Rasa Betawi,Johannes Peddy Wongsowidjojo,Jakarta Selatan,021 7501125,,Restoran,15/50/B
Kafe Betawi,"Mall Kota Kasablanka, Jl. Casablanca Kav. 9-10",PT. Citra Rasa Betawi,Johannes Peddy W,Jakarta Selatan,021 7500382,021 7500382,Restoran,15/50/B
Kafe Betawi,"Gandaria City, Jl. Sultan Iskandar Muda No. 8",PT. Citra Rasa Betawi,Johannes Peddy W,Jakarta Selatan,021 7399088,021 7399088,Restoran,15/50/B
Kafe Betawi,"Gd. Setiabudi I, Jl. HR. Rasuna Said Kav. 62",PT.Citra Rasa Betawi,Johannes Peddy Wongsowidjojo,Jakarta Selatan,,,Restoran,15/50/B
Kafe Betawi,Jl. Jend. Sudirman No. 52-53 BEJ,PT. Betawi Citra Rasa,Johannes Peddy W,Jakarta Selatan,021 7500382,021 7500382,Restoran,15/50/B
Kafe Betawi,"Plaza Pondok Indah, Jl. Metro Blok B/III/B",PT. Citra Rasa Betawi,Johannes Peddy W,Jakarta Selatan,021 7500383,,Restoran,22/88/A
Kafe Betawi,"Kemang Village Mall, Jl. Kemang VI",PT. Citra Rasa Betawi,Johannes Peddy W,Jakarta Selatan,021 7500382,021 7500382,Restoran,15/50/B
